username;date;retweets;favorites;text;geo;mentions;hashtags;id;permalink;sentimento;local
LeiaJaOnline;2018-06-11 16:45;2;2;pastor eurico nao rabo preso ninguem  3x141h;;;#T;1,00626126617496E+018;https://twitter.com/LeiaJaOnline/status/1006261266174959621;['negativo'];
edvaldomoraispe;2018-06-08 21:39;0;0;rosa weber nega seguimento queixacrime contra pastor eurico ;;;;1,00524794284706E+018;https://twitter.com/edvaldomoraispe/status/1005247942847057921;['negativo'];Olinda-PE
carmemsantos55;2018-06-08 20:43;0;0;rosa weber nega seguimento queixacrime contra pastor eurico icablogfolha20180607blg65927509politica2419rosawebernegaseguimentoqueixacrimecontrapastoreuricoaspx ;;;;1,00523390142453E+018;https://twitter.com/carmemsantos55/status/1005233901424533506;['negativo'];Recife-PE
DanAdjuto;2018-06-08 13:28;7;24;o min luiz fux marcou depoimento dep pastor eurico testemunha defesa jair bolsonaro acao e reu injuria incitacao crime estupro pastor eurico ouvido dia 08 h;;;;1,00512429133004E+018;https://twitter.com/DanAdjuto/status/1005124291330035712;['negativo'];
vascomunistas;2018-06-08 01:38;0;0;rosa weber nega seguimento queixacrime contra pastor eurico http;;;;1,00494576241169E+018;https://twitter.com/vascomunistas/status/1004945762411687936;['negativo'];Rio de Janeiro, Brazil
partidoPEN51;2018-06-07 11:39;0;0;cabo daciolo pastor eurico fazem pronunciamento favor caminhoneiros http;;@YouTube;;1,00473452189865E+018;https://twitter.com/partidoPEN51/status/1004734521898651649;['negativo'];Brasil
marcknho;2018-06-04 13:08;0;0;pode  ;;@BolsonaroSP @BolsonaroSP @Francischini_ @alberto_fraga @PastorEurico @marcofeliciano @lincoln_portela @flavinhocn @IzalciLucas @onyxlorenzoni @marcknho @anaamelialemos @ronaldocaiado @lasiermartins @MagnoMalta;;1,00366991731554E+018;https://twitter.com/marcknho/status/1003669917315543041;['neutro'];Curitiba
RenatinhoNeto;2018-06-03 20:16;6;38;valdir ta la porque fez campanha eurico inclusive arregimentando muitos socios campo grande mas unica vez testado bem e idolo clube inegavelmente ainda acho vem medalhao segurar barra pastor;;;;1,00341515552133E+018;https://twitter.com/RenatinhoNeto/status/1003415155521327107;['negativo'];Leblon - RJ - Brasil
51pauloroberto;2018-06-01 19:49;0;0;na tarde desta sextafeira 1 recebendo visita deputado federal presidente patriota pastor eurico junto participamos batepapo radio tabocas fm sobre cotidiano facebookpaulorobertopr oficialposts2080501348906078 ;;;;1,00268358172921E+018;https://twitter.com/51pauloroberto/status/1002683581729210369;['positivo'];
igandradee;2018-05-30 22:04;0;0;pqp alguem manda padre pastor ir la sj amor deus pai santo qualquer coisa pra tira macumba eurico;;;;1,00199285932162E+018;https://twitter.com/igandradee/status/1001992859321622528;['negativo'];Cordovil, Rio de Janeiro
eduardonino;2018-05-28 20:10;5;4;retweeted eduardo deputados pe votaram pra entregar petroleo pre sal empresas estrangeiras shell exnmobil totaletc cadoca pdt pastor eurico phs jarbas vasconcelos mdb kaio manicoba mdb facebookeduardosilvas ouzaposts1807456639276211 ;;@eduardonino;;1,00123935594242E+018;https://twitter.com/eduardonino/status/1001239355942424579;['positivo'];Brazil
eduardonino;2018-05-28 17:29;16;16;deputados pe votaram pra entregar petroleo pre sal empresas estrangeiras shell exnmobil totaletc cadoca pdt pastor eurico phs jarbas vasconcelos mdb kaio manicoba mdb facebookeduardosilvas ouzaposts1807456639276211 ;;;;1,00119871690313E+018;https://twitter.com/eduardonino/status/1001198716903133192;['positivo'];Brazil
GildazioMouraPT;2018-05-28 13:05;0;0;deputados pe votaram pra entregar petroleo pre sal empresas estrangeiras shell exn mobil totaletc podem informar onde caras agora cadoca pdt pastor eurico phs facebookgildaziomouraposts10209090753746426 ;;;;1,00113236868027E+018;https://twitter.com/GildazioMouraPT/status/1001132368680271872;['positivo'];Recife - Pernambuco
Paivasil;2018-05-28 12:36;0;0;deputados pe votaram pra entregar petroleo pre sal empresas estrangeiras shell exnmobil totaletc cadoca pdt pastor eurico phs jarbas vasconcelos mdb kaio manicoba mdb fernando monteiro pp dudu fonte pp creuza pereira psb;;;;1,00112499840325E+018;https://twitter.com/Paivasil/status/1001124998403248129;['positivo'];Curitiba, Brazil
djincidental;2018-05-28 12:05;0;0;faz printi ai  deputados pe votaram pra entregar petroleo pre sal empresas estrangeiras shell exn mobil etc cadoca pdt pastor eurico phs jarbas vasconcelos mdb kaio manicoba facebookdjincidentalp osts10213997807354154 ;;;;1,00111727155983E+018;https://twitter.com/djincidental/status/1001117271559831552;['negativo'];Olinda - Pernambuco - Brazil
nibiru201545;2018-05-27 18:21;0;0;jorge silva es nao marcelo aro mg sim marcelo matos rj sim pastor eurico pe sim total phs pmb weliton prado mg nao total pmb mdb alceu moreira rs sim alexandre serfiotis rj sim altineu cortes rj sim andre amaral pb sim anibal gomes ce sim baleia rossi sp;;;;1,00084938005065E+018;https://twitter.com/nibiru201545/status/1000849380050653184;['positivo'];
nibiru201545;2018-05-27 18:20;0;0;phs carlos andrade rr sim diego garcia pr sim dr jorge silva es nao marcelo aro mg sim marcelo matos rj sim pastor eurico pe sim total phs pmb weliton prado mg nao total pmb mdb alceu moreira rs sim alexandre serfiotis rj sim altineu cortes rj sim andre;;;;1,00084921395621E+018;https://twitter.com/nibiru201545/status/1000849213956214784;['positivo'];
rutelira;2018-05-27 10:24;0;0;pastor eurico inacio lima pastor amigo deus abencoe sempre vida bencaos medidas agradecemos deus vida;;;;1,00072939542911E+018;https://twitter.com/rutelira/status/1000729395429105665;['negativo'];brasil
opbbrasil;2018-05-26 21:01;0;0;adicionei video lista reproducao  eurico e opb contra pec;;@YouTube;;1,00052737477207E+018;https://twitter.com/opbbrasil/status/1000527374772068352;['negativo'];Recife, Brazil
michellypolyana;2018-05-20 11:23;0;0;essa galera sirinhaem vive reclamando prefeito esquecem deputados prometeram nada cumpriram vou comecar querido pastor eurico pois nele votei agora vi nenhum facebookmichellepolian posts1967962803246034 ;;;;9,98207693004341E+017;https://twitter.com/michellypolyana/status/998207693004341248;['negativo'];Recife
Nill_Junior;2018-05-16 16:52;0;0;pastor eurico visita hospital regional emilia camara  4dga5dcwo;;;;9,96840720232202E+017;https://twitter.com/Nill_Junior/status/996840720232202240;['negativo'];Pernambuco
vascomunistas;2018-05-15 12:36;0;1;pastor eurico reclama obstrucao partidos esquerda camara http;;;;9,96414121523405E+017;https://twitter.com/vascomunistas/status/996414121523404800;['negativo'];Rio de Janeiro, Brazil
blogdejamildo;2018-05-15 11:58;0;1;pastor eurico reclama obstrucao partidos esquerda camara ;;;;9,96404548574044E+017;https://twitter.com/blogdejamildo/status/996404548574044160;['positivo'];Pernambuco, Brasil
jairogaraujo;2018-05-15 07:58;0;0;eu nada ver governo ai mim faz parte governo anterior afirma pastor eurico blogdojairogomes201805nao nadavergovernohtmlspref;;;;9,96343940751266E+017;https://twitter.com/jairogaraujo/status/996343940751265792;['negativo'];Santa Cruz do Capibaribe/PE
jairogaraujo;2018-05-15 07:57;0;0;o deputado federal pastor eurico penpe durante entrevista concedida a filadelfia fm falou sobre luta junto movimento emancipacionista brasilia alem comentar importancia dignidade politica sobretudo proximidade blogdojairogomes201805nao nadavergovernohtmlspref;;;;9,96343921990095E+017;https://twitter.com/jairogaraujo/status/996343921990094848;['positivo'];Santa Cruz do Capibaribe/PE
fabiocoutsilva;2018-05-09 11:15;1;0;boa parte parlamentares phs base eleitoral fieis assembleia deus outras denominacoes evangelicas neste ano assembleia deus quer lancar pastor eurico senado legenda;;;;9,94219199244497E+017;https://twitter.com/fabiocoutsilva/status/994219199244496906;['negativo'];
marcknho;2018-05-06 18:30;0;0; istatus993185156507799552 ;;@BolsonaroSP @Francischini_ @deltanmd @EderMauroPA @delegado_waldir @alberto_fraga @onyxlorenzoni @marcofeliciano @DepSostenes @MarcosRogerio @IzalciLucas @lincoln_portela @JanainaDoBrasil @PastorEurico @PastorMalafaia @aguinaldaosilva @roxmo @rogeriosmarinho;;9,93241506919211E+017;https://twitter.com/marcknho/status/993241506919211008;['negativo'];Curitiba
Pref_Eldorado;2018-05-05 13:12;0;0;feira de adoo realizada praca pastor eurico silva praca central acao secretaria municipal meio ambiente smam ocorrera h venha participar de lar facebookprefeldoradodo sulvideos1675149105896847;;;;9,9279916156423E+017;https://twitter.com/Pref_Eldorado/status/992799161564229632;['negativo'];Eldorado do Sul, Brasil
pedro_eurico_;2018-05-04 21:18;0;0;quando pastor faz referencia vivo pra cazuza;;;;9,92559007972905E+017;https://twitter.com/pedro_eurico_/status/992559007972904960;['positivo'];Rio de Janeiro, Brasil
EuricoAraujo;2018-05-04 11:05;0;0;o senhor e pastor nada faltara  gloria aleluia eurico araujo facebookeuricoaraujov ideos1761958033861903;;;;9,92404954399855E+017;https://twitter.com/EuricoAraujo/status/992404954399854592;['neutro'];PARANÁ / BRASIL
partidoPEN51;2018-05-03 10:37;0;0;deputado pastor eurico presta solidariedade vereador dr rodrigo lagoa itaengape http;;@YouTube;;9,92035509877854E+017;https://twitter.com/partidoPEN51/status/992035509877854208;['negativo'];Brasil
eurico_ces;2018-04-29 17:04;0;0;por pais e epessoas querem brigar imagem ganhar imoralidade faltacarater bola amorteceu mao pastor reclamou;;;;9,90683170122105E+017;https://twitter.com/eurico_ces/status/990683170122104832;['negativo'];
arthurquares;2018-04-25 23:02;1;0;existem tres tipos criminosos merecem tudo ruim pior pena possivel politico corrupto pastor elorador cartola corrupto o q corja corruptos fazem brasil q edir macedo faz fieis q eurico campello fazem c vasco  imperdovel porra;;;;9,8932377482992E+017;https://twitter.com/arthurquares/status/989323774829920258;['negativo'];Seropédica, Brasil
ONG_GABRASIL;2018-04-23 13:26;0;0;ccj aprova projeto amplia subsidio energia agricultura irrigada aquicultura pastor eurico  ;;;;9,88454026940428E+017;https://twitter.com/ONG_GABRASIL/status/988454026940428288;['positivo'];Brasil-São Paulo-Bebedouro
AlineRicardo88;2018-04-22 10:10;0;0;pastor jacinto manto to solto vinicius rodrigues eurico aguiar ;;;#YouTube #T;9,88042346385281E+017;https://twitter.com/AlineRicardo88/status/988042346385281025;['negativo'];Vitória, Brazil
Matt_BR_Nicacio;2018-04-21 21:11;0;0;pode pegar pista nova lado feitosa rua desembargador helio cabral lado jaca rua pastor eurico calheiros passando sitios bar pode ir lesteoeste deserto pode ir piabas perigoso q  pode ir conjunto bariloche;;;;9,87846402817569E+017;https://twitter.com/Matt_BR_Nicacio/status/987846402817568769;['negativo'];Império de Alagoas
joaohenrique100;2018-04-20 17:33;0;0;pastor eurico declara solideriedade seca sertao pernambucano http;;@YouTube;;9,87429059541E+017;https://twitter.com/joaohenrique100/status/987429059541000193;['negativo'];Brasil
partidoPEN51;2018-04-18 16:44;0;0;pastor eurico presta solidariedade vitimas enchentes sertao pernambucano http;;@YouTube;;9,86692015176999E+017;https://twitter.com/partidoPEN51/status/986692015176998913;['negativo'];Brasil
jorgersm;2018-04-18 15:58;0;1;deputado pastor eurico fala camara crime gleisi hoffman cometeu pedir ajuda terroristas nos representou;;;#GleisiNaCadeia;9,86680365241823E+017;https://twitter.com/jorgersm/status/986680365241823232;['negativo'];Jundiaí, Brasil
fabianosmith123;2018-04-14 14:59;0;0;hoje fazendo homenagem melhor amigo paizao pastor eurico feliz aniversario  ;;;;9,85216090442789E+017;https://twitter.com/fabianosmith123/status/985216090442788864;['positivo'];São Paulo, Brasil
IzaMilanez;2018-04-13 17:58;0;0;nosso site izaimobiliaria br codigo anuncio ap0149 alugamos lindo apartamento mobiliado ed puerto cristal rua pastor eurico alfredo nelson embratel apartamento mobiliado sala facebookizaimobiliaria posts1809473449116381 ;;;;9,84898582972166E+017;https://twitter.com/IzaMilanez/status/984898582972166145;['negativo'];Rondônia, Brazil
jairogaraujo;2018-04-10 17:13;0;0;prefeito rafael municipio afranio agradece deputado pastor eurico blogdojairogomes201804prefei torafaelmunicipioafraniohtmlspref;;;;9,83800152451355E+017;https://twitter.com/jairogaraujo/status/983800152451354626;['negativo'];Santa Cruz do Capibaribe/PE
jairogaraujo;2018-04-10 17:13;0;0;prefeito rafael temos deputados voto afranio ajudaram mil votos disse receber trator pastor eurico blogdojairogomes201804prefei torafaelmunicipioafraniohtmlspref;;;;9,83800046436127E+017;https://twitter.com/jairogaraujo/status/983800046436126720;['negativo'];Santa Cruz do Capibaribe/PE
jgeraldo1966;2018-04-10 15:12;0;0;vamos ligar para os deputados do pen e pedir que retirem o pedido de liminar do stf dep erivelton santana 2756 dep junior marreca 2537 dep pastor eurico 5900 dep walney rocha 5575;;;;9,83769734142448E+017;https://twitter.com/jgeraldo1966/status/983769734142447616;['negativo'];Minas Gerais
jgeraldo1966;2018-04-10 14:59;0;1;o brasil conta com o apoio do para o bem da nao e o fortalecimento no combate  corrupo retirem o pedido de liminar no contamos com vocs e o brasil agradece;;@partidoPEN51 @STF_oficial @Adilson_Barroso @DepErivelton @juniormarreca @PastorEurico @walneyrocha;;9,83766333291729E+017;https://twitter.com/jgeraldo1966/status/983766333291728896;['positivo'];Minas Gerais
Silbass;2018-04-10 05:40;0;1;continuacao pastor eurico penpe 61 5906 deppastoreuricolegbr walney rocha penrj 61 5575 depwalneyrochalegbr;;@camara @camara;;9,83625861474726E+017;https://twitter.com/Silbass/status/983625861474725888;['negativo'];São Paulo BR
caminhosereno;2018-04-09 20:33;0;1;imagine pastor eurico querendo justificar ovelhas e bem assim decisao advogado partido bla bla bla eu diria pra puteiro organizacaors rs rs;;;;9,83488141783945E+017;https://twitter.com/caminhosereno/status/983488141783945216;['negativo'];Santa Catarina, Brasil
Mary_Greicy;2018-04-09 17:00;0;1;deputado pastor eurico do pen de pernambuconao serve povo 2yrciuljkf;;;#SERVIR;9,83434396719026E+017;https://twitter.com/Mary_Greicy/status/983434396719026177;['negativo'];
edmilsoncassian;2018-04-09 15:42;0;0;pastor eurico facebookjanetecassiano cassiano3videos1004595773023268;;;;9,83414797709578E+017;https://twitter.com/edmilsoncassian/status/983414797709578241;['negativo'];Brasil
SPD_33;2018-04-09 14:19;36;46;deputado pastor eurico pen patriota quer salvar todos presos lava jato presos  instancia mande recado pra quem solta bandido no tem voto da populao ;;@partidoPEN51;;9,83393998478995E+017;https://twitter.com/SPD_33/status/983393998478995456;['negativo'];Orlando, FL
coimaac;2018-04-09 13:04;0;0;deputado pastor eurico cadeia espera bandido desgracado;;;;9,83375094117528E+017;https://twitter.com/coimaac/status/983375094117527555;['negativo'];
VemLutarBrasil;2018-04-09 12:59;9;7;deputado pen patriota quer salvar todos presos lava jato presos  instancia mande recado pra quem solta bandido no tem voto da populao deputado pastor eurico pen pe 3s2i4prw;;@partidoPEN51;;9,83373852335108E+017;https://twitter.com/VemLutarBrasil/status/983373852335108097;['negativo'];
lidialoureir6;2018-04-09 11:43;0;0;eu fiz parte faca erivelton santana penba deperiveltonsantanalegbr junior marreca penma depjuniormarrecalegbr pastor eurico penpe deppastoreuricolegbr walney rocha penrj depwalneyrochalegbr  status983347914956263424 ;;@camara @camara @camara @camara;;9,83354710051738E+017;https://twitter.com/lidialoureir6/status/983354710051737600;['negativo'];Brazil
VemLutarBrasil;2018-04-09 10:52;3;6;erivelton santana penba 61 5756 deperiveltonsantanalegbr junior marreca penma 5537 depjuniormarrecalegbr pastor eurico penpe 5906 deppastoreuricolegbr walney rocha penrj 5575 depwalneyrochalegbr;;@camara @camara @camara @camara;;9,83341792845353E+017;https://twitter.com/VemLutarBrasil/status/983341792845352960;['negativo'];
mabotelho;2018-04-08 16:49;1;1;molezas justica testemunha bolsonaro caso apologia estupro pastor eurico alega compromissos campanha adia depoimento agosto com julgamento presidenciavel vai calendas gregas 9gqo0apcs;;;;9,83069417075565E+017;https://twitter.com/mabotelho/status/983069417075564544;['negativo'];Minas Gerais, Brasil
gabrielbarberes;2018-04-08 13:56;0;0;testemunha defesa presidenciavel jair bolsonaro psl acao penal injuria apologia crime estupro deputado pastor eurico avisou justica disponibilidade depor apos agosto com oitiva bolsonaro facebookgabrielbarber esposts2119016511448220 ;;;;9,83025879700984E+017;https://twitter.com/gabrielbarberes/status/983025879700983808;['positivo'];
misspratinha;2018-04-08 11:14;0;1;o pastor eurico fazendo favorzinho deputado  testemunha cumplice  status982983591561965568 ;;;;9,82985063183913E+017;https://twitter.com/misspratinha/status/982985063183912960;['negativo'];iPhone: 0.000000,0.000000
TucaPinheiroDF;2018-04-08 09:09;0;0;coluna estadao to ocupado testemunha defesa presidenciavel jair bolsonaro psl acao penal injuria apologia crime estupro deputado pastor eurico avisou justica facebooktucapinheiro posts10214130256403859 ;;;;9,82953460671934E+017;https://twitter.com/TucaPinheiroDF/status/982953460671934464;['positivo'];Brasília, Brasil
colunadoestadao;2018-04-08 06:00;3;5;na testemunha defesa presidenciavel psl acao penal injuria deputado pastor eurico avisou justica disponibilidade depor apos agosto com oitiva bolsonaro ficara agosto;;@colunadoestadao @jairbolsonaro @mariadorosario;;9,82905894475149E+017;https://twitter.com/colunadoestadao/status/982905894475149312;['positivo'];Brasília, Brasil
davimunizpe;2018-04-06 12:59;0;0;deputado federal pastor eurico ato filiacao patriota ;;;;9,82286672720118E+017;https://twitter.com/davimunizpe/status/982286672720117760;['positivo'];Recife, Brazil
davimunizpe;2018-04-06 10:54;0;0;eu deputado federal pastor eurico noite pra ficar historia patriota  ;;;;9,82255242824725E+017;https://twitter.com/davimunizpe/status/982255242824724482;['negativo'];Recife, Brazil
juniorpitangui;2018-04-05 13:14;0;0;tem saida phs pastor eurico phspe deixa partido vai pen patriota queiram agora ambos partidos pen phs possuem cadeiras camara federal;;;;9,81928138883195E+017;https://twitter.com/juniorpitangui/status/981928138883194880;['negativo'];Brasil
davimunizpe;2018-04-05 11:47;0;0;deputado federal pastor eurico  recebido com festa no patriota ontem 0404 clube ;;;;9,81906061610443E+017;https://twitter.com/davimunizpe/status/981906061610442754;['positivo'];Recife, Brazil
Nill_Junior;2018-04-05 11:21;0;0;ato filiacao pastor eurico reune cupula patriotas recife  ;;;;9,81899630479859E+017;https://twitter.com/Nill_Junior/status/981899630479859712;['neutro'];Pernambuco
EdmarLyra;2018-04-05 10:34;0;0;ato filiacao pastor eurico reune cupula patriotas recife edmarlyraatofiliaca pastoreuricoreunecupulapatriotasrecife 1abg;;;;9,81887680664482E+017;https://twitter.com/EdmarLyra/status/981887680664481792;['neutro'];Recife - PE.
cordeiro6273;2018-04-03 07:14;0;0;pastor eurico define filiacao patriotas  euricodefinefiliacaohtmlspref;;;;9,81112677845164E+017;https://twitter.com/cordeiro6273/status/981112677845164032;['negativo'];Taquaritinga do Norte-PE
EdmarLyra;2018-04-02 21:53;0;0;pastor eurico define filiacao patriotas edmarlyrapastoreurico definefiliacaopatriotas 0zlzu;;;;9,80971421139702E+017;https://twitter.com/EdmarLyra/status/980971421139701761;['negativo'];Recife - PE.
GRyan_23;2018-03-28 19:36;1;1;pastor eurico ;;;;9,79125105174417E+017;https://twitter.com/GRyan_23/status/979125105174417408;['negativo'];Caarapó - Mato Grosso do Sul 
jairogaraujo;2018-03-25 10:00;0;0;deputado pastor eurico  homenageado em solenidade dos militares evanglicos de pernambuco blogdojairogomes201803deputa pastoreuricohomenageadohtmlspref;;;;9,77893100067742E+017;https://twitter.com/jairogaraujo/status/977893100067741697;['negativo'];Santa Cruz do Capibaribe/PE
marcknho;2018-03-25 09:54;0;0; tus970390488007233536 ;;@BolsonaroSP @JoseMedeirosMT @anaamelialemos @SimoneTebetms @MagnoMalta @JanainaDoBrasil @veramagalhaes @ronaldocaiado @lasiermartins @marcofeliciano @flavinhocn @DepSostenes @IzalciLucas @PastorEurico;;9,77891346987004E+017;https://twitter.com/marcknho/status/977891346987003904;['negativo'];Curitiba
Nill_Junior;2018-03-17 17:22;0;0;para onde vai pastor eurico  ;;;;9,75105176813138E+017;https://twitter.com/Nill_Junior/status/975105176813137921;['negativo'];Pernambuco
PY1IB;2018-03-07 12:16;0;1;crivella manda tecnico capaz ajustar q anos scomputadores chamavam onda verde  adianta mandar pastor na avmaracana cmata machado eurico rabelo sao francisco xavier sinal abre seguinte fechado o abre o fechado ;;;#sbtrio #RJTV1;9,71404187543261E+017;https://twitter.com/PY1IB/status/971404187543261185;['positivo'];Rio de Janeiro
AlexBzrra;2018-03-06 11:34;0;0;gostei video   pastor eurico defesa cegonheiros pernambuco;;@YouTube;;9,7103129040008E+017;https://twitter.com/AlexBzrra/status/971031290400079873;['negativo'];Betim - MG - Brasil
AlexBzrra;2018-02-28 07:29;0;0;raquel dodge rejeita tentativa de medioli de calar pastor eurico noticias betim jornal tribuna betim ;;;;9,68795260762681E+017;https://twitter.com/AlexBzrra/status/968795260762681344;['negativo'];Betim - MG - Brasil
LeiaJaOnline;2018-02-26 20:28;0;2;deputado pastor eurico quer acabar sacrificio animais rituais religiosos  0klrj;;;;9,68266652134642E+017;https://twitter.com/LeiaJaOnline/status/968266652134641664;['negativo'];
edsoarespe;2018-02-26 06:53;0;0;dep federal pastor pedro eurico phspe apresenta projeto acabar sacrifcio de animais rituais ;;;;9,68061388282388E+017;https://twitter.com/edsoarespe/status/968061388282388480;['positivo'];Barreiros, Brasil
CHA_Hajima;2018-02-22 21:04;0;0;devolve;;;;9,66826104899154E+017;https://twitter.com/CHA_Hajima/status/966826104899153920;['negativo'];Florianópolis, Brazil
EdmilsonSilvri3;2018-02-20 17:53;0;1;o simples fato existir pessoas minas gerais sao paulo transporte veiculos novos doe pernambuco ja e visto cartel raquel dodge rejeita tentativa medioli calar pastor eurico  via;;@wordpressdotcom;;9,66053099046625E+017;https://twitter.com/EdmilsonSilvri3/status/966053099046625280;['positivo'];São Bernardo do Campo, Brasil
marcknho;2018-02-14 21:51;1;1;tudo e aprovado congresso voto impresso mec tirando ideologia mpf vai judicializar  tatus963839087454162944 ;;@anaamelialemos @SimoneTebetms @MagnoMalta @JoseMedeirosMT @alvarodias_ @marcknho @MarcosRogerio @IzalciLucas @flavinhocn @lincoln_portela @PastorEurico @onyxlorenzoni @BolsonaroSP;;9,63923746921812E+017;https://twitter.com/marcknho/status/963923746921811969;['negativo'];Curitiba
OrdemdosTaxista;2018-02-14 18:15;0;0;deputado pastor eurico diz feito acordo falsos lideres taxistas traidores profissao ;;;;9,63869295301333E+017;https://twitter.com/OrdemdosTaxista/status/963869295301332992;['negativo'];Brasil
fhfc_ma;2018-02-12 20:20;0;1;hey fhfc family pastor eurico lomba is requesting prayer big service taking place in brava this friday from am to pm lets believe with them move of god like brava has never seen before and that many souls will be saved;;;#capeverdeforjesus #fhfcinc;9,63176033204818E+017;https://twitter.com/fhfc_ma/status/963176033204817920;['positivo'];207 Main St, Dighton MA 02715
marcknho;2018-02-12 16:56;0;0;nao deixem guerreira sozinha  qstatus963101742010388482 ;;@MagnoMalta @JoseMedeirosMT @onyxlorenzoni @BolsonaroSP @jairbolsonaro @ronaldocaiado @anaamelialemos @SimoneTebetms @senadorflexa @Reguffe @jcaleluia @DepSostenes @Francischini_ @PastorEurico @marcofeliciano @JanainaDoBrasil;;9,63124700405789E+017;https://twitter.com/marcknho/status/963124700405788673;['negativo'];Curitiba
marcknho;2018-01-30 09:49;0;0; ostatus958141219930099713 ;;@padrejoaozinho @padre_paulo @padremanzotti @padrejonasabib @pemarcelorossi @JanainaDoBrasil @DepSostenes @flavinhocn @PastorEurico @marcofeliciano @MagnoMalta;;9,58306080899174E+017;https://twitter.com/marcknho/status/958306080899174401;['negativo'];Curitiba
podechamarqvou;2018-01-27 11:46;0;0;esta alimentando fieis;;;;9,57248508582552E+017;https://twitter.com/podechamarqvou/status/957248508582551553;['negativo'];Rio de Janeiro, Brasil
_CreuzaPereira;2018-01-25 18:11;0;2;em petrolina visitei julianeli tolentino reitor acompanhar andamento instalacoes universidade salgueiro estamos luta acelerar liberacao emenda bancada enviada mim deputados pastor eurico gonzaga patriota 2u;;;#Univasf;9,56620625963114E+017;https://twitter.com/_CreuzaPereira/status/956620625963114501;['negativo'];Salgueiro, Brasil
jairogaraujo;2018-01-25 16:03;0;0;pastor eurico destina recursos para o hospital evanglico de pernambuco ;;;;9,56588447283675E+017;https://twitter.com/jairogaraujo/status/956588447283675136;['negativo'];Santa Cruz do Capibaribe/PE
jairogaraujo;2018-01-25 16:03;0;0;com recursos emenda parlamentar deputado federal pastor eurico phs hospital evangelico ;;;;9,56588423032332E+017;https://twitter.com/jairogaraujo/status/956588423032332289;['negativo'];Santa Cruz do Capibaribe/PE
marcknho;2018-01-21 12:32;0;0; us955077732853080065 ;;@Francischini_ @PastorEurico @freire_roberto @alberto_fraga @BolsonaroSP @majorolimpio;;9,55085814698004E+017;https://twitter.com/marcknho/status/955085814698004481;['negativo'];Curitiba
leoescur;2018-01-20 00:49;0;0;o candidato comeu dia mes;;;;9,54546339823673E+017;https://twitter.com/leoescur/status/954546339823673344;['negativo'];
alderson_araujo;2018-01-19 23:13;0;2;eurico  meu pastor e nada me faltar;;;;9,54522318491017E+017;https://twitter.com/alderson_araujo/status/954522318491017216;['negativo'];
MarkosOliveira;2018-01-18 14:54;0;0;no doc entre homens bem cena durante discussao tematica genero pne dep pastor eurico usa caso pra provocar acusar jean microfone presidente comissao deixa jean fazer uso palavra;;;;9,54034310771823E+017;https://twitter.com/MarkosOliveira/status/954034310771822592;['negativo'];Brasília, Brasil
