username;date;retweets;favorites;text;geo;mentions;hashtags;id;permalink;sentimento;local
JosiasR18001461;2017-10-20 02:58;0;0;ccj deputado pastor eurico fala sobre denuncia contra michel temer  svccjdeputadopastoreuricofalasobredenunciacontramicheltemer6004504 ;;;;9,21239201575776E+017;https://twitter.com/JosiasR18001461/status/921239201575776256;['positivo'];
fabianosmith123;2017-10-19 19:19;0;0;jantar aniversario casa paizao pastor eurico maezona ;;;#Meuanivers;9,21123563901542E+017;https://twitter.com/fabianosmith123/status/921123563901542402;['negativo'];São Paulo, Brasil
fcrodrigues2016;2017-10-18 19:21;0;0;votei plano governo eleito p ser vice vergonha bradileira;;@PastorEurico @dilmabr @MichelTemer @camaradeputados @MidiaNINJA;;9,20761679587217E+017;https://twitter.com/fcrodrigues2016/status/920761679587217409;['positivo'];São José do Rio Pardo, Brasil
R_A_F_A_E_L_L_;2017-10-18 19:20;0;0;parabens dep pastor eurico;;;;9,20761499420938E+017;https://twitter.com/R_A_F_A_E_L_L_/status/920761499420938240;['negativo'];Localizando.....
johnconstantyne;2017-10-18 19:19;0;0;pastor eurico lamentavel puxasaco ninguem vota vice idiota;;;#ForaTemer;9,20761295661621E+017;https://twitter.com/johnconstantyne/status/920761295661621248;['negativo'];Rio de Janeiro RJ Brasil
ViniciusNikolod;2017-10-18 19:19;0;0;pastor eurico fala ataques oposicao contra temer;;;;9,20761186597163E+017;https://twitter.com/ViniciusNikolod/status/920761186597163008;['positivo'];日本 東京
BernardoMF;2017-10-18 13:41;7;46;nao rrrrrrrrrabo prrrrrrrrreso o deputado pastor eurico parece casseta imitando galvao bueno rrrrrrrrrrrronaldinho;;;;9,20676141459034E+017;https://twitter.com/BernardoMF/status/920676141459034112;['positivo'];Rio de Janeiro, Brazil
ro_lustosa;2017-10-18 13:39;0;0;deixe ser cinico pastor eurico vcs julgando temer pernambuco vendo;;;#Dep;9,20675699559666E+017;https://twitter.com/ro_lustosa/status/920675699559665665;['negativo'];Recife/BRASIL
capitu46;2017-10-18 13:38;0;0;dep pastor eurico odio pt;;;;9,20675574850441E+017;https://twitter.com/capitu46/status/920675574850441217;['negativo'];Brasília - Brazil
capitu46;2017-10-18 13:35;0;1;esse pastor eurico e braco direito capeta ta falando camara agora;;;;9,20674773981651E+017;https://twitter.com/capitu46/status/920674773981650945;['negativo'];Brasília - Brazil
ro_lustosa;2017-10-18 13:35;0;0;pastor eurico dep pernambuco vendo cinismo fugindo tangente p votar favor temer;;;;9,20674747351994E+017;https://twitter.com/ro_lustosa/status/920674747351994368;['neutro'];Recife/BRASIL
c_melges;2017-10-18 13:35;1;1;pastor eurico acaba de dizer q no houve ditadura no brasile que no houve no perodo do governo militar essa roubalheira atualparabns;;;;9,20674726779019E+017;https://twitter.com/c_melges/status/920674726779019264;['negativo'];São Paulo, Brasil
_dehlessa;2017-10-18 13:35;0;0;pastor eurico phs dizendo ccj ditadura o ocorreu governo preparatorio democracia;;;;9,20674703953596E+017;https://twitter.com/_dehlessa/status/920674703953596416;['negativo'];São Paulo, Brasil
MarkosOliveira;2017-10-18 13:34;1;0;deputado pastor eurico phspe ccj defendendo ditadura militar discurso defesa temer;;;;9,20674536747688E+017;https://twitter.com/MarkosOliveira/status/920674536747687936;['positivo'];Brasília, Brasil
Nabuco;2017-10-18 13:34;1;1;sim vendo deputado defendendo ditadura militar pastor eurico e nome pastor;;;;9,20674385794683E+017;https://twitter.com/Nabuco/status/920674385794682880;['negativo'];Rio de Janeiro, Brasil
htsnet;2017-10-17 10:20;0;0;como assunto correcao tabela imposto renda isso pressa a populacao merece;;@PastorEurico;;9,20263355511857E+017;https://twitter.com/htsnet/status/920263355511857152;['negativo'];São Paulo, SP, Brasil
IzaMilanez;2017-10-15 21:54;0;0;ed puerto cristal mobiliado rua pastor eurico alfredo nelson embratel lindo apartamento ;;;;9,19713009672606E+017;https://twitter.com/IzaMilanez/status/919713009672605699;['positivo'];Rondônia, Brazil
marcknho;2017-10-15 21:41;0;0;print  ;;@marcofeliciano @flavinhocn @rogeriosmarinho @MarcosRogerio @IzalciLucas @DepSostenes @BolsonaroSP @PastorEurico @lincoln_portela;;9,197098095109E+017;https://twitter.com/marcknho/status/919709809510899714;['negativo'];Curitiba
amdanon;2017-10-15 15:04;0;0;parabens efusivos deputado federal pastor eurico defesa correto justo contra preconceitos ;;;;9,19609868004229E+017;https://twitter.com/amdanon/status/919609868004229120;['positivo'];Sao Paulo
pletz;2017-10-11 20:30;0;0;o deputado federal pastor eurico manifesta relacao discurso odio judeus realizado restaurante ;;;;9,18257499467387E+017;https://twitter.com/pletz/status/918257499467386880;['positivo'];Brasil
mairakubik;2017-10-11 15:18;1;1;julho dispoe sobre crimes hediondos hoje designado relatoria dep pastor eurico phspe ccjc;;;;9,18178912869474E+017;https://twitter.com/mairakubik/status/918178912869474304;['negativo'];Salvador, Brasil
marcknho;2017-10-09 10:47;0;0;isso e realmente partido politico  ostatus917382000041975808 ;;@PastorEurico @onyxlorenzoni @OdeCarvalho @flavinhocn @senadorflexa @aguinaldaosilva @SimoneTebetms;;9,17386043141259E+017;https://twitter.com/marcknho/status/917386043141259265;['negativo'];Curitiba
tvnautando;2017-10-08 01:48;0;0;monarquia phs humanismo solidarista partido pastor eurico diego garcia;;;;9,16888074176664E+017;https://twitter.com/tvnautando/status/916888074176663552;['negativo'];
tvidigital;2017-10-07 15:35;0;0;deputado federal pastor eurico papa lingua reage contra museu arte moderna ;;;;9,1673362226627E+017;https://twitter.com/tvidigital/status/916733622266269700;['negativo'];Ilha Solteira SP
MARCOSPALITOPE;2017-10-07 02:07;0;0;este sim honra voto pernambucanos parabns deputado federal pastor eurico;;;;9,16530433336139E+017;https://twitter.com/MARCOSPALITOPE/status/916530433336139776;['negativo'];RECIFE - PE
MARCOSPALITOPE;2017-10-07 01:55;0;0;vale a pena registrar parabns deputado federal pastor eurico ;;;;9,16527281706865E+017;https://twitter.com/MARCOSPALITOPE/status/916527281706864640;['negativo'];RECIFE - PE
coxinhadaelite;2017-10-04 22:50;0;0;dep pastor eurico desviando assunto fundao vamos ver voto 9kc8uprttn;;;;9,1575593800237E+017;https://twitter.com/coxinhadaelite/status/915755938002370560;['negativo'];Porto Alegre, Brasil
netojorge_;2017-10-04 22:49;0;0;pastor eurico phspe tribuna condenar eicao criancas nudez;;;;9,15755880192336E+017;https://twitter.com/netojorge_/status/915755880192335872;['neutro'];Paraíba, Brazil
ClaudeLuca_;2017-10-04 22:49;3;12;pastor eurico fala desrespeito criancas mostra aberta criancas bsb cada foto aberracao;;;;9,15755680962896E+017;https://twitter.com/ClaudeLuca_/status/915755680962895872;['negativo'];Sao Paulo, Brazil
Carfeina;2017-10-03 20:39;0;0;o melhor e discurso pastor eurico;;;;9,15360785194476E+017;https://twitter.com/Carfeina/status/915360785194475521;['positivo'];Curitiba, Brasil
luizcebola;2017-10-03 20:36;0;0;o phs pastor  eurico  eu rico pobre;;;;9,15360000712888E+017;https://twitter.com/luizcebola/status/915360000712888320;['negativo'];Tamboré, SP - BRAZIL
f_gordinho;2017-10-03 00:23;0;0;esse pastor e deputado federal pernambuco francisco eurico e homem serio representa  y671394459712820id100005268165266  8sdu7dxf4o;;;;9,1505462074506E+017;https://twitter.com/f_gordinho/status/915054620745060352;['negativo'];Jaboatão dos Guararapes, Brasi
giomangia;2017-10-02 18:46;0;0;so li tribuna agora tal pastor eurico dizimo sendo homofobico pudor a camara serve pra nada;;@camaradeputados;;9,14969879543009E+017;https://twitter.com/giomangia/status/914969879543009280;['negativo'];Porto Alegre/RS
fabianosmith123;2017-10-01 18:03;0;0;jantar aniversario casa paizao pastor eurico maezona ;;;#Meuanivers;9,14596746038252E+017;https://twitter.com/fabianosmith123/status/914596746038251520;['negativo'];São Paulo, Brasil
canaldasbee;2017-09-27 19:57;0;0;i added video to playlist  morumbi pastor eurico bixa preta buscando ongs;;@YouTube;;9,13175812387504E+017;https://twitter.com/canaldasbee/status/913175812387504131;['neutro'];Anywhere but Nárnia 
f_gordinho;2017-09-12 15:39;0;0;feliz aniversario amigo irmao pastor deputado federal francisco eurico 33p8a;;;;9,07674938680774E+017;https://twitter.com/f_gordinho/status/907674938680774668;['positivo'];Jaboatão dos Guararapes, Brasi
AimeCarvalho2;2017-09-12 14:04;0;0;a paz senhor todos hoje e aniversario deputado federal pastor eurico nesta data especial ;;;;9,07651035203863E+017;https://twitter.com/AimeCarvalho2/status/907651035203862531;['negativo'];
AimeCarvalho2;2017-09-10 17:36;0;0;nota de pesar foi tristeza recebemos noticia falecimento mae pastor eurico deputado ;;;;9,06979782277116E+017;https://twitter.com/AimeCarvalho2/status/906979782277115904;['positivo'];
