username;date;retweets;favorites;text;geo;mentions;hashtags;id;permalink
ParlaTube;2018-03-07 15:17;0;1;dep gonzaga patriota psb faz apelo promocao pracas forcas armadas ;;@psbnacamara;;971449876981706754;https://twitter.com/ParlaTube/status/971449876981706754
euflavionunes;2018-03-07 15:07;0;0;gonzaga patriota inicia semana pauta extensa governador paulo camara   3d2jqzt;;;;971447160528130049;https://twitter.com/euflavionunes/status/971447160528130049
ahammsportsgeek;2018-03-07 01:11;1;3;college of charleston south dakota state liu gonzaga and wright state all punch their tickets to the ncaa tournament tonight the patriot league will punch their ticket tomorrow 8dzdmu2f;;;;971236873766166528;https://twitter.com/ahammsportsgeek/status/971236873766166528
ArenaFanatic;2018-03-06 23:39;1;3;my first wave of conference tournament ;;;;971213776337895424;https://twitter.com/ArenaFanatic/status/971213776337895424
ParlaTube;2018-03-06 14:37;0;0;dep gonzaga patriota psb fala sobre congresso psb sauda novo bispo petrolina pe ;;;;971077416952172544;https://twitter.com/ParlaTube/status/971077416952172544
ParlaTube;2018-03-06 14:37;0;1;dep gonzaga patriota psb fala sobre congresso psb sauda novo bispo petrolina pe ;;@psbnacamara;;971077395095617536;https://twitter.com/ParlaTube/status/971077395095617536
charlesaraujox;2018-03-06 13:27;0;0;dep federal gonzaga patriota destaca movimento prol pe camara federal algonzagapatriotadestacamovimentoprolpe630camarafederal;;;;971059601285238784;https://twitter.com/charlesaraujox/status/971059601285238784
Debi__Pereira;2018-03-06 13:16;0;0;governador recebe demandas romario dias gonzaga patriota ebedemandasromariodiasgonzagapatriota;;;;971057047813926912;https://twitter.com/Debi__Pereira/status/971057047813926912
ArenaFanatic;2018-03-05 23:02;1;3;my first wave of conference tournament ;;;;970841982099697664;https://twitter.com/ArenaFanatic/status/970841982099697664
Nill_Junior;2018-03-05 21:05;0;0;gua custodia petrolina agenda gonzaga patriota paulo camara  15sjk;;;;970812655488430080;https://twitter.com/Nill_Junior/status/970812655488430080
roberto40224824;2018-03-05 19:43;0;0;gonzaga patriota inicia semana pauta extensa governador paulo camara blog roberto goncalves ;;;;970791906572582912;https://twitter.com/roberto40224824/status/970791906572582912
roberto40224824;2018-03-05 19:41;0;0;gonzaga patriota inicia semana pauta extensa governador paulo camara blog roberto goncalves ;;;;970791536760799232;https://twitter.com/roberto40224824/status/970791536760799232
ArenaFanatic;2018-03-04 22:10;2;5;my first wave of conference tournament ;;;;970466508433444870;https://twitter.com/ArenaFanatic/status/970466508433444870
tweetedstuff;2018-03-03 01:15;0;1;my autobid ;;;;969788219775770627;https://twitter.com/tweetedstuff/status/969788219775770627
Andre78ferreira;2018-03-02 21:10;2;3;foram deputados querem tirar direito escolher locomover dia dia psb pp psb severinoninho psb avante zecacavalcanti ptb 8bjvdyatll;;@RadioJornalAMFM @jc_pe @dia @CreuzaPereira @EduardodaFonte @GonzagaPatriota @SilvioCosta_dep;;969726783863083009;https://twitter.com/Andre78ferreira/status/969726783863083009
N_Carvalheira;2018-03-02 10:32;7;3;gonzaga patriota pe psb valor gasto mes r 4406 gastou divulgacao r 0000 presencassessoes 1 fonte vidinha balada 8hakupm;;;;969566210340872193;https://twitter.com/N_Carvalheira/status/969566210340872193
roberto40224824;2018-03-01 20:20;0;0;gonzaga patriota defende familias assentamentos perimetro irrigado pontal petrolina blog roberto ;;;;969351684735451137;https://twitter.com/roberto40224824/status/969351684735451137
roberto40224824;2018-03-01 20:19;0;0;gonzaga patriota defende familias assentamentos perimetro irrigado pontal petrolina blog roberto ;;;;969351507958116352;https://twitter.com/roberto40224824/status/969351507958116352
_rachelamaral;2018-03-01 11:57;0;0;nosso turismo precisa disso;;@luizlaurofilho @heraclitopi @gonzagapatriota @DepDaniloForte @DeputadoFoletto @odoricomonteiro;#PL2724 #ApoioPL2724 #EmbraturAgencia;969225027248934912;https://twitter.com/_rachelamaral/status/969225027248934912
alleandrosoares;2018-03-01 09:49;0;0;agradecer deputado creuza pereira gonzaga patriota severino ninho silvio costa zeca cavalcanti serem a favor povo pernambucano votacao ontem aos demais resposta vira logo;;@eduardodafonte;;969192914445324290;https://twitter.com/alleandrosoares/status/969192914445324290
ParlaTube;2018-02-28 14:45;0;3;dep gonzaga patriota psbpe faz apelo familias assentamento maria tereza ;;@psbnacamara;;968905103146127361;https://twitter.com/ParlaTube/status/968905103146127361
pettygpimenta;2018-02-27 17:25;0;0;apoiando turismo gente gera renda auxilia desenvolvimento to brasil;;@heitorschuch @luizlaurofilho @heraclitopi @gonzagapatriota @DaniloForte @DeputadoFoletto;#ApoiePL2724 #PL2724 #EmbraturAgencia;968582895269969920;https://twitter.com/pettygpimenta/status/968582895269969920
ParlaTube;2018-02-27 14:25;0;0;dep gonzaga patriota psbpe destaca reuniao sobre pavimentacao rodovia pe630 ;;;;968537591233564673;https://twitter.com/ParlaTube/status/968537591233564673
ParlaTube;2018-02-27 14:24;0;0;dep gonzaga patriota psbpe destaca reuniao sobre pavimentacao rodovia pe630 ;;@psbnacamara;;968537366309810178;https://twitter.com/ParlaTube/status/968537366309810178
roberto40224824;2018-02-27 12:52;0;0;gonzaga patriota participa  conferencia estadual transposicao rio tocantins palmas blog ;;;;968514305405591552;https://twitter.com/roberto40224824/status/968514305405591552
roberto40224824;2018-02-27 11:36;0;0;gonzaga patriota participa  conferencia estadual transposicao rio tocantins palmas blog ;;;;968495094792904704;https://twitter.com/roberto40224824/status/968495094792904704
Nill_Junior;2018-02-27 07:37;0;0;gonzaga patriota defende transposicao rio tocantins palmas  60iss3ym;;;;968434797231116288;https://twitter.com/Nill_Junior/status/968434797231116288
blogdidigalvao;2018-02-27 05:02;0;0;gonzaga patriota participa  conferencia estadual transposicao rio tocantins palmas patriotaparticipa1aconferenciaestadualtransposicaoriotocantinspalmas;;;;968395967669194752;https://twitter.com/blogdidigalvao/status/968395967669194752
mary_joy_morais;2018-02-26 15:36;0;0;gonzaga patriota diz posicionamento politicos tocantinenses contra transposicao rio tocantins e resultado falta conhecimento conexao tocantins portal noticias   via;;@conexaoto;;968193005323784192;https://twitter.com/mary_joy_morais/status/968193005323784192
Reporter1_TO;2018-02-26 15:03;0;0;gonzaga patriota diz posicionamento politicos tocantinenses contra transposicao rio tocantins e resultado falta conhecimento ;;;;968184790624194560;https://twitter.com/Reporter1_TO/status/968184790624194560
conexaoto;2018-02-26 13:18;0;0;gonzaga patriota diz posicionamento politicos tocantinenses contra transposicao rio tocantins e res ;;;;968158315011338240;https://twitter.com/conexaoto/status/968158315011338240
MeioAmbienteTO;2018-02-26 12:28;1;3;hj tarde conferencia mobilizacao p forum mundial gua ii ecobt assuntos e transposicao rio tocantins participa deputado federal gonzaga patriota autor projeto lei preve interligacao rio tocantins rio preto 4;;;;968145791553548289;https://twitter.com/MeioAmbienteTO/status/968145791553548289
waldineypassos;2018-02-23 19:00;0;0;gonzaga patriota participa conferencia sobre transposicao rio tocantins segundafeira 26 taparticipaconferenciasobretransposicaoriotocantinssegundafeira26 1ccloo;;;;967157327106162688;https://twitter.com/waldineypassos/status/967157327106162688
carlosbritto1;2018-02-23 16:45;0;0;gonzaga patriota participara palmas  conferencia estadual transposicao rio tocantins carlosbrittogonzagapatrio taparticiparapalmas1aconferenciaestadualtransposicaoriotocantins 4zd5xan4ys;;;;967123306389352448;https://twitter.com/carlosbritto1/status/967123306389352448
osecretariopovo;2018-02-23 12:09;0;0;gonzaga patriota debate transposicao rio tocantins  tadebatetransposicaoriotocantins 8zemh50g;;;;967053924745269253;https://twitter.com/osecretariopovo/status/967053924745269253
roberto40224824;2018-02-23 11:58;0;0;gonzaga patriota debate transposicao rio tocantins blog roberto goncalves ;;;;967051003471245312;https://twitter.com/roberto40224824/status/967051003471245312
roberto40224824;2018-02-23 11:51;0;0;gonzaga patriota debate transposicao rio tocantins blog roberto goncalves ;;;;967049189191487488;https://twitter.com/roberto40224824/status/967049189191487488
Nill_Junior;2018-02-23 10:49;0;0;gonzaga patriota debate transposicao rio tocantins  1eets3sun;;;;967033800877322241;https://twitter.com/Nill_Junior/status/967033800877322241
NovoRefis;2018-02-22 13:52;0;1;deputado federal gonzaga patriota defesa refis micro pequenas empresas  algonzagapatriotadefesarefismicropequenasempresas;;;;966717395766149121;https://twitter.com/NovoRefis/status/966717395766149121
ParlaTube;2018-02-21 17:06;0;0;dep gonzaga patriota psbpe faz apelo fruticultores banana santa maria boa vista ;;@psbnacamara;;966403732979273729;https://twitter.com/ParlaTube/status/966403732979273729
euflavionunes;2018-02-21 09:06;0;0;gonzaga patriota participa encontro defesa micro pequena empresa  ;;;;966282999921700865;https://twitter.com/euflavionunes/status/966282999921700865
ParlaTube;2018-02-20 20:56;0;1;dep gonzaga patriota registra homenagem policia rodoviaria federal destaca trabalho ;;@psbnacamara;;966099232263372801;https://twitter.com/ParlaTube/status/966099232263372801
Nill_Junior;2018-02-20 17:18;0;0;deputado federal gonzaga patriota participa encontro defesa micro pequena empresa  9wybov4hh8;;;;966044323480522754;https://twitter.com/Nill_Junior/status/966044323480522754
roberto40224824;2018-02-20 16:38;0;0;deputado federal gonzaga patriota defesa micro pequena empresa blog roberto goncalves ;;;;966034415380869121;https://twitter.com/roberto40224824/status/966034415380869121
ParlaTube;2018-02-20 15:04;0;1;dep gonzaga patriota registra homenagem policia rodoviaria federal destaca trabalho ;;@psbnacamara;;966010734231552003;https://twitter.com/ParlaTube/status/966010734231552003
ParlaTube;2018-02-20 15:03;0;0;dep gonzaga patriota registra homenagem policia rodoviaria federal destaca trabalho ;;;;966010514005463042;https://twitter.com/ParlaTube/status/966010514005463042
roberto40224824;2018-02-19 19:12;0;0;deputado federal gonzaga patriota destaca atividades semana congresso nacional blog roberto goncalves ;;;;965710631264333825;https://twitter.com/roberto40224824/status/965710631264333825
PajeuAM;2018-02-19 18:50;0;0;gonzaga patriota destaca atividades semana congresso patriotadestacaatividadessemanacongresso;;;;965705253181181954;https://twitter.com/PajeuAM/status/965705253181181954
Nill_Junior;2018-02-19 18:15;0;0;gonzaga patriota destaca atividades semana congresso  3ydje8fh;;;;965696465686487042;https://twitter.com/Nill_Junior/status/965696465686487042
noahsmygirl;2018-02-17 21:50;0;3;holy heart vs gonzaga tomorrow boys championship young odonel patriots team with nice showing tonight  atus964981500809830400 ;;;;965010640573288448;https://twitter.com/noahsmygirl/status/965010640573288448
Gabriel27027;2018-02-16 23:50;0;0;gonzaga patriota jose rochaatila liraeduardo barbosaatila linsnelson marquezelliroberto balestraarnaldo fariajutahy junior paes ladimsarney filhoarolde oliveira simao sessimmiro teixeira;;;;964678316887330816;https://twitter.com/Gabriel27027/status/964678316887330816
AlwaysMarch_;2018-02-16 17:06;8;5;conference leaders thru february ovc belmontmurray st 2 p12 arizona 3 patriot bucknell 2 sec auburn 2 swac grambling 3 socon etsu 1 southland nicholls 2 summit sdsu 1 sun belt louisiana 1 wac nm state 1 wcc gonzaga 1;;;;964576851233525760;https://twitter.com/AlwaysMarch_/status/964576851233525760
ParlaTube;2018-02-07 14:17;0;1;dep gonzaga patriota psbpe defende derrubada veto refis micro pequenas empresas ;;@psbnacamara;;961272630904000512;https://twitter.com/ParlaTube/status/961272630904000512
ParlaTube;2018-02-06 17:31;0;0;dep gonzaga patriota psbpe fala sobre seguranca carnaval pernambuco ;;;;960959180252303365;https://twitter.com/ParlaTube/status/960959180252303365
euflavionunes;2018-02-05 15:28;0;0;gonzaga patriota comemora anuncio estudo sobre interligacao rios tocantins sao francisco  ;;;;960565777685450759;https://twitter.com/euflavionunes/status/960565777685450759
farnesios;2018-02-05 14:11;0;0;deputado gonzaga patriota festeja autorizao para estudos da integrao das bacias do tocantins com o so francisco ;;;;960546318266531841;https://twitter.com/farnesios/status/960546318266531841
tuthill_travis;2018-02-05 02:56;1;9;i rooted gonzaga they lost i rooted the dodgers they lost i rooted the predators they lost i rooted the cavaliers they lost i rooted georgia they lost i rooted the patriots they lost im capitals wizards redskins and nationals fan;;;;960376541002764289;https://twitter.com/tuthill_travis/status/960376541002764289
RyanSchuiling;2018-02-04 23:17;1;7;really want this nick foles would be such great story 20 on all of this obviously means the patriots are going to win like unc beating gonzaga in the ncaa title game cant beat city hall;;@SchuilingReport;;960321543170658305;https://twitter.com/RyanSchuiling/status/960321543170658305
TheCount1017;2018-02-04 22:24;0;0;wagers patriots ml 110 parlayed wgonzaga and auburn ml un 1 on the props so far blount un loss yes fg yards or less converted win pending brady mvp 100 sacks un over 145m bet on per nevada gaming;;;#SuperBowl #SuperBowl;960308108651200512;https://twitter.com/TheCount1017/status/960308108651200512
guil_gonzaga;2018-02-04 21:30;0;0;entao galera quantos erros cruciais arbitragem favor patriots hj eu chuto;;;;960294588970885122;https://twitter.com/guil_gonzaga/status/960294588970885122
Nill_Junior;2018-02-03 10:00;0;0;gonzaga patriota comemora anuncio estudo sobre interligacao tocantins  sao francisco  4m6gb;;;;959758447528108032;https://twitter.com/Nill_Junior/status/959758447528108032
roberto40224824;2018-02-02 22:28;0;0;temer promete estudar projeto gonzaga patriota integrar rios sao francisco tocantins blog ;;;;959584378664857600;https://twitter.com/roberto40224824/status/959584378664857600
roberto40224824;2018-02-02 22:27;0;0;temer promete estudar projeto gonzaga patriota integrar rios sao francisco tocantins blog ;;;;959584160242266113;https://twitter.com/roberto40224824/status/959584160242266113
Nill_Junior;2018-02-02 20:19;0;1;gonzaga patriota lamenta derrubada liminar proibe privatizar eletrobras  6gfrukcj;;;;959551798859255808;https://twitter.com/Nill_Junior/status/959551798859255808
carlosbritto1;2018-02-01 20:01;0;0;o deputado federal gonzaga patriota psbpe encerrou agenda pernambuco durante recesso parlamentar ;;;;959184838493315072;https://twitter.com/carlosbritto1/status/959184838493315072
carlosbritto1;2018-02-01 20:00;0;0;gonzaga patriota encerra agenda recesso parlamentar balanco municipios visitados carlosbrittogonzagapatrio taencerraagendarecessoparlamentarbalanco56municipiosvisitados ;;;;959184797900795905;https://twitter.com/carlosbritto1/status/959184797900795905
roberto40224824;2018-02-01 18:52;0;0;gonzaga patriota visita municipios durante recesso parlamentar blog roberto goncalves ;;;;959167663007125504;https://twitter.com/roberto40224824/status/959167663007125504
roberto40224824;2018-02-01 18:51;0;0;gonzaga patriota visita municipios durante recesso parlamentar blog roberto goncalves ;;;;959167405887901696;https://twitter.com/roberto40224824/status/959167405887901696
PajeuAM;2018-01-31 20:02;0;0;gonzaga patriota visita municipios durante recesso parlamentar patriotavisita56municipiosduranterecessoparlamentar ;;;;958822733084807168;https://twitter.com/PajeuAM/status/958822733084807168
Nill_Junior;2018-01-31 18:20;0;0;gonzaga patriota visita municipios durante recesso parlamentar  1ew69f4;;;;958797224531693569;https://twitter.com/Nill_Junior/status/958797224531693569
waldineypassos;2018-01-26 08:20;0;0;gonzaga patriota assume presidencia comite provisorio psb lucas ramos e vice taassumepresidenciacomiteprovisoriopsblucasramosvice 2vqh;;;;956834299722043392;https://twitter.com/waldineypassos/status/956834299722043392
carlosbritto1;2018-01-25 19:30;1;0;o deputado federal gonzaga patriota voltou presidencia psb petrolina passa ter novamente ;;;;956640339133165576;https://twitter.com/carlosbritto1/status/956640339133165576
carlosbritto1;2018-01-25 19:29;0;0;do novo transformado diretorio gonzaga patriota volta presidir legenda petrolina carlosbrittonovotransf ormadodiretoriogonzagapatriotavoltapresidirlegendapetrolina ;;;;956640310364426243;https://twitter.com/carlosbritto1/status/956640310364426243
_CreuzaPereira;2018-01-25 18:11;0;2;em petrolina visitei julianeli tolentino reitor acompanhar andamento instalacoes universidade salgueiro estamos luta acelerar liberacao emenda bancada enviada mim deputados pastor eurico gonzaga patriota 2u;;;#Univasf;956620625963114501;https://twitter.com/_CreuzaPereira/status/956620625963114501
Nill_Junior;2018-01-25 15:41;0;2;gonzaga patriota volta presidencia psb petrolina  8tka0h0zu;;;;956582734486532096;https://twitter.com/Nill_Junior/status/956582734486532096
roberto40224824;2018-01-23 15:53;0;0;gonzaga patriota despacha paulo camara recife blog roberto goncalves ;;;;955861153518731264;https://twitter.com/roberto40224824/status/955861153518731264
roberto40224824;2018-01-23 15:51;0;0;gonzaga patriota despacha paulo camara recife blog roberto goncalves ;;;;955860611576901632;https://twitter.com/roberto40224824/status/955860611576901632
Nill_Junior;2018-01-23 15:10;0;0;gonzaga patriota despacha paulo camara recife  3l2bslkd0;;;;955850202010804224;https://twitter.com/Nill_Junior/status/955850202010804224
Nill_Junior;2018-01-23 10:40;0;0;gonzaga patriota destaca anos codigo transito brasileiro  2r8941bx4;;;;955782261328285696;https://twitter.com/Nill_Junior/status/955782261328285696
PajeuAM;2018-01-23 10:39;0;0;gonzaga patriota destaca anos codigo transito brasileiro patriotadestaca20anoscodigotransitobrasileiro 1t8xgdsiug;;;;955781978560847872;https://twitter.com/PajeuAM/status/955781978560847872
osecretariopovo;2018-01-23 10:29;0;0;gonzaga patriota destaca anos codigo transito brasileiro  tadestaca20anoscodigotransitobrasileiro 8jmjpgq;;;;955779529020198912;https://twitter.com/osecretariopovo/status/955779529020198912
950KJRPodcasts;2018-01-22 22:12;0;0;new episode ian furness furness h1 nfl fans hate the new england patriots gary parrish from cbs sports on washington and gonzaga hoopsedgar hof chances listen now ;;;;955594106637553664;https://twitter.com/950KJRPodcasts/status/955594106637553664
guil_gonzaga;2018-01-22 17:24;0;0;955450841615536128 ;;;;955521549603352576;https://twitter.com/guil_gonzaga/status/955521549603352576
izaurinobrasil;2018-01-22 10:53;0;0;gonzaga patriota visita bonito governador paulo camara  1avcwz;;;;955423115131129857;https://twitter.com/izaurinobrasil/status/955423115131129857
roberto40224824;2018-01-22 10:05;0;0;gonzaga patriota lado lado todo estado governador paulo camara blog roberto goncalves ;;;;955411060793729026;https://twitter.com/roberto40224824/status/955411060793729026
roberto40224824;2018-01-22 10:03;0;0;gonzaga patriota lado lado todo estado governador paulo camara blog roberto goncalves ;;;;955410688746446848;https://twitter.com/roberto40224824/status/955410688746446848
carlosbritto1;2018-01-22 07:41;0;0;gonzaga patriota paulo camara quatro cantos estado nao negar deputado federal gonzaga ;;;;955374798296797184;https://twitter.com/carlosbritto1/status/955374798296797184
guil_gonzaga;2018-01-22 00:00;0;0;patriots  o corinthians da nfl toma no cu;;;;955258741468876801;https://twitter.com/guil_gonzaga/status/955258741468876801
guil_gonzaga;2018-01-21 23:54;0;0;alguem sabe dizer patriots ganhou roubado dnv;;;#PlayoffsNfl;955257210807967744;https://twitter.com/guil_gonzaga/status/955257210807967744
AtticIsMyCity;2018-01-21 21:10;0;19;favorite nba bulls nfl patriots nhl flyers mlb mariners college football huskies college basketball gonzaga bulldogs;;;;955215976718508033;https://twitter.com/AtticIsMyCity/status/955215976718508033
Nill_Junior;2018-01-21 08:17;0;0;gonzaga patriota acompanha governador bonito  22wc32m0al;;;;955021511617929216;https://twitter.com/Nill_Junior/status/955021511617929216
smoores87;2018-01-20 17:03;0;0;my first live event was ufc where gonzaga shocked the world by decapitating cro cop also saw the pride unification at ufc hendo vs rampage;;;;954791614609838081;https://twitter.com/smoores87/status/954791614609838081
DPope919;2018-01-20 01:18;0;1;my last bets are jacksonville over patriots ml at 265 half unit unc to win the natty half unit and then later bet of units after unc lost to wofford we dropped to 1 behind teams like gonzaga and xavier who have absolutely chance payout is over units total;;;;954553746964533249;https://twitter.com/DPope919/status/954553746964533249
APJuazeiro;2018-01-19 10:01;0;0;gonzaga patriota cumpre agenda secretarios estado recife http;;;;954322984021479431;https://twitter.com/APJuazeiro/status/954322984021479431
osecretariopovo;2018-01-18 11:17;0;0;gonzaga patriota visita fundacao altino ventura recife  tavisitafundacaoaltinoventurarecife 45ysdqiwvu;;;;953979677508595712;https://twitter.com/osecretariopovo/status/953979677508595712
Nill_Junior;2018-01-18 09:38;0;0;gonzaga patriota participa reunioes cidade recife  4qbthbe98;;;;953954683596496897;https://twitter.com/Nill_Junior/status/953954683596496897
blogviniciuspe;2018-01-18 07:36;0;1;gonzaga patriota cumpre agenda secretarios estado recife  tacumpreagendasecretariosestadorecife ;;;;953923938333200384;https://twitter.com/blogviniciuspe/status/953923938333200384
roberto40224824;2018-01-17 18:10;0;0;gonzaga patriota cumpre agenda secretarios estado recife blog roberto goncalves ;;;;953721197216219136;https://twitter.com/roberto40224824/status/953721197216219136
roberto40224824;2018-01-17 18:10;0;0;gonzaga patriota cumpre agenda secretarios estado recife blog roberto goncalves ;;;;953721112625491969;https://twitter.com/roberto40224824/status/953721112625491969
Nill_Junior;2018-01-17 08:24;0;0;gonzaga patriota cumpre agenda secretarios estado recife  8i69n6tr;;;;953573834183069696;https://twitter.com/Nill_Junior/status/953573834183069696
APJuazeiro;2018-01-17 08:22;0;0;gonzaga patriota cumpre agenda secretarios estado recife http;;;;953573215628152833;https://twitter.com/APJuazeiro/status/953573215628152833
waldineypassos;2018-01-16 22:00;0;0;gonzaga patriota passou dia visitando secretarios estaduais recife tapassoudiavisitandosecretariosestaduaisrecife 9yv;;;;953416661729759237;https://twitter.com/waldineypassos/status/953416661729759237
blogdidigalvao;2018-01-16 21:50;0;0;gonzaga patriota cumpre agenda secretarios estado recife ;;@Shareaholic;;953414264596975616;https://twitter.com/blogdidigalvao/status/953414264596975616
therichreport;2018-01-15 17:02;2;3;pac12 arizona patriot boston sec auburn southern east tennessee state southland nicholls swac jackson state summit south dakota state sun belt louisiana wcc gonzaga wac new mexico state;;;;952979365368815616;https://twitter.com/therichreport/status/952979365368815616
blogdoroberiosa;2018-01-15 14:12;0;1;ao lado gonzaga patriota ngelo ferreira assina ordem servico sertania  7werupsx5n;;;;952936486927781888;https://twitter.com/blogdoroberiosa/status/952936486927781888
matt_hammac;2018-01-14 03:22;0;0;last free plays are winners patriots win big 14 team west coast teaser wins st marys wins 67 and gonzaga wins 65 and boise state closes out the night with big moneyline win over damn good san diego state team 80;;;#Freeplays #freepicksdaily;952410547034775552;https://twitter.com/matt_hammac/status/952410547034775552
SledgePatrick5;2018-01-14 02:02;0;0;patriots titans gonzaga san francisco;;;;952390322734161920;https://twitter.com/SledgePatrick5/status/952390322734161920
CPY87;2018-01-14 01:03;1;3;i refuse to watch any game involving the team of choice i simply wonder how much the have to pay the league every season to buy off the refs but im happy tonight watching gonzaga play san fran  rstatus952363816326660096 ;;@NFL;#Patriots #TENvsNE;952375666393206784;https://twitter.com/CPY87/status/952375666393206784
DrunkStan69420;2018-01-13 16:48;1;6;parlay lock of the year falcons patriots team total over gonzaga villanova 50 to win 600;;;;952250993940553729;https://twitter.com/DrunkStan69420/status/952250993940553729
TDTOTD;2018-01-13 06:45;0;0;shooters mentality just keep shooting weve got full slate tomorrow patriots 1h patriots uk webster gonzaga lets get back on track family ;;;;952099285989863424;https://twitter.com/TDTOTD/status/952099285989863424
Nill_Junior;2018-01-11 15:28;0;0;deputado gonzaga patriota segue extensa agenda sertao  3rbefr8d;;;;951506079271309312;https://twitter.com/Nill_Junior/status/951506079271309312
darciorabelo;2018-01-11 14:07;0;0;deputado gonzaga patriota segue extensa agenda sertao ;;;;951485645616185345;https://twitter.com/darciorabelo/status/951485645616185345
roberto40224824;2018-01-10 17:42;0;0;deputado gonzaga patriota cumpre agenda sertao blog roberto goncalves ;;;;951177544904056833;https://twitter.com/roberto40224824/status/951177544904056833
roberto40224824;2018-01-10 17:42;0;0;deputado gonzaga patriota cumpre agenda sertao blog roberto goncalves ;;;;951177499139915776;https://twitter.com/roberto40224824/status/951177499139915776
blogviniciuspe;2018-01-09 21:54;0;0;deputado gonzaga patriota cumpre agenda sertao  gapatriotacumpreagendasertao 0bc4glbreu;;;;950878445860478977;https://twitter.com/blogviniciuspe/status/950878445860478977
waldineypassos;2018-01-09 20:37;0;0;deputado gonzaga patriota cumpre agenda sertao gapatriotacumpreagendasertao 0f5x2dtukp;;;;950858990401015808;https://twitter.com/waldineypassos/status/950858990401015808
darciorabelo;2018-01-09 19:42;0;1;deputado gonzaga patriota cumpre agenda sertao pajeu ;;;;950845346388717568;https://twitter.com/darciorabelo/status/950845346388717568
