username;date;retweets;favorites;text;geo;mentions;hashtags;id;permalink
PajeuAM;2018-01-09 19:33;0;0;gonzaga patriota golpista e rouba ladrao patriotagolpistaroubanaoladrao 2l5ayhkg;;;;950842917656190977;https://twitter.com/PajeuAM/status/950842917656190977
Nill_Junior;2018-01-09 19:29;0;0;gonzaga patriota golpista e rouba ladrao  3wquqlk1q;;;;950842078547861504;https://twitter.com/Nill_Junior/status/950842078547861504
clayfrancis10;2018-01-09 03:41;4;46;the past years of sports have been amazing nba basketball cavs vs warriors 3 c31 c23 cbb villanova vs north carolina 74 cbb north carolina vs gonzaga 65 nfl falcons vs patriots 28;;;;950603400416317440;https://twitter.com/clayfrancis10/status/950603400416317440
blogviniciuspe;2018-01-08 22:30;0;0;emendas deputado gonzaga patriota senador douglas cintra contempla petrolina   utadogonzagapatriotasenadordouglascintracontemplapetrolina25ruaspavimentadasprefeitojaautorizouiniciouobras 8i;;;;950525143385821185;https://twitter.com/blogviniciuspe/status/950525143385821185
MikeMol1982;2018-01-07 20:40;1;5;we should forever be proud that dubliner educated at gonzaga and is the reason why millions of young europeans can study anywhere in europe he was patriot and upheld the very best of being irish on world stage it is up to our generation leo to secure his legacy;;@ucddublin;;950134969686548481;https://twitter.com/MikeMol1982/status/950134969686548481
Nill_Junior;2018-01-07 16:56;0;0;gonzaga patriota entrega tratores pequenos produtores rurais cabrobo  3ynod;;;;950078713764483072;https://twitter.com/Nill_Junior/status/950078713764483072
Nill_Junior;2018-01-05 09:17;0;0;gonzaga patriota solidariza fruticultores projeto fulgencio  0wd0t07v;;;;949238474825175043;https://twitter.com/Nill_Junior/status/949238474825175043
osecretariopovo;2018-01-04 23:26;0;0;gonzaga patriota solidariza fruticultores projeto fulgencio  tasolidarizafruticultoresprojetofulgencio;;;;949089678719844352;https://twitter.com/osecretariopovo/status/949089678719844352
roberto40224824;2017-12-31 12:03;0;0;gonzaga patriota reune grupo politico araripina blog roberto goncalves ;;;;947468336975220736;https://twitter.com/roberto40224824/status/947468336975220736
roberto40224824;2017-12-31 12:03;0;0;gonzaga patriota reune grupo politico araripina blog roberto goncalves ;;;;947468185435033600;https://twitter.com/roberto40224824/status/947468185435033600
APJuazeiro;2017-12-31 08:20;0;0;gonzaga patriota procura ser diferente colegas prostituiram trocando voto favores http;;;;947412125072461824;https://twitter.com/APJuazeiro/status/947412125072461824
carlosbritto1;2017-12-30 15:35;1;0;voltando velho estilo deputado federal gonzaga patriota psb fez duras criticas parlamentares ;;;;947159230653415424;https://twitter.com/carlosbritto1/status/947159230653415424
APJuazeiro;2017-12-30 14:51;0;0;gonzaga patriota procura ser diferente colegas prostituiram trocando voto favores http;;;;947148090867376129;https://twitter.com/APJuazeiro/status/947148090867376129
osecretariopovo;2017-12-30 13:46;0;0;gonzaga patriota reune grupo politico araripina  tareunegrupopoliticoararipina 05qapzgdf7;;;;947131717193818112;https://twitter.com/osecretariopovo/status/947131717193818112
Nill_Junior;2017-12-30 11:22;0;0;gonzaga patriota critica deputados trocam voto favores  6rtb;;;;947095634477244416;https://twitter.com/Nill_Junior/status/947095634477244416
roberto40224824;2017-12-29 12:09;0;0;gonzaga patriota cumpre agenda serrita trindade blog roberto goncalves ;;;;946744870714183681;https://twitter.com/roberto40224824/status/946744870714183681
roberto40224824;2017-12-29 12:08;0;0;gonzaga patriota cumpre agenda serrita trindade blog roberto goncalves ;;;;946744752816390144;https://twitter.com/roberto40224824/status/946744752816390144
darciorabelo;2017-12-29 09:01;0;0;deputado gonzaga patriota cumpre agenda serrita trindade ;;;;946697804008841216;https://twitter.com/darciorabelo/status/946697804008841216
Nill_Junior;2017-12-29 08:11;0;0;gonzaga patriota cumpre agenda serrita trindade  ;;;;946684978171170816;https://twitter.com/Nill_Junior/status/946684978171170816
n_eavenson;2017-12-29 02:14;13;21;dc gonzaga s 6 allin blunt looks better and better in the successive weeks i saw him this month big south a east ne conf meac ivy patriots;;@GonzagaHoops;#SlamDunkDE;946595151971012608;https://twitter.com/n_eavenson/status/946595151971012608
blogdoroberiosa;2017-12-27 07:56;0;0;gonzaga patriota lidera deputado federal seguido lucas ramos adalberto  1vw8c;;;;945956614644948992;https://twitter.com/blogdoroberiosa/status/945956614644948992
valecomentar;2017-12-26 16:30;0;0;gonzaga patriota disse pt armando monteiro neto julio lossio poderao marchar   zagapatriotadisseptarmandomonteironetojuliolossiopoderaomarcharreeleicaopaulocamara 5xyogm;;;;945723497514401792;https://twitter.com/valecomentar/status/945723497514401792
Nill_Junior;2017-12-26 11:43;0;0;gonzaga patriota entrega trator comunidade rural itapetim  8frofk;;;;945651168604192769;https://twitter.com/Nill_Junior/status/945651168604192769
everaldo_sr;2017-12-26 10:00;0;0;gonzaga patriota disse pt armando monteiro neto julio lossio poderao marchar reeleicao paulo camara ;;;;945625269926166528;https://twitter.com/everaldo_sr/status/945625269926166528
roberto40224824;2017-12-25 10:35;0;0;pt psb juntos diz gonzaga patriota blog roberto goncalves ;;;;945271844311130112;https://twitter.com/roberto40224824/status/945271844311130112
roberto40224824;2017-12-25 10:34;0;0;pt psb juntos diz gonzaga patriota blog roberto goncalves ;;;;945271636504309761;https://twitter.com/roberto40224824/status/945271636504309761
patricionunes12;2017-12-24 18:19;0;0;artigo a importancia familia gonzaga patriota ;;;;945026163205742592;https://twitter.com/patricionunes12/status/945026163205742592
carlosbritto1;2017-12-24 14:51;0;0;o deputado federal gonzaga patriota psb reuniuinicio tarde ontem 23 imprensa local ;;;;944973700633366529;https://twitter.com/carlosbritto1/status/944973700633366529
divulgapetro;2017-12-24 11:45;0;0;gonzaga patriota realiza confraternizacao imprensa divulgapetrolina201712gonzag patriotarealizahtml ;;;;944927084790640641;https://twitter.com/divulgapetro/status/944927084790640641
blogviniciuspe;2017-12-24 10:23;0;0;deputado gonzaga patriota reune imprensa tradicional confraternizacao fim ano convocao geral ;;;;944906286545752064;https://twitter.com/blogviniciuspe/status/944906286545752064
Nill_Junior;2017-12-24 10:20;0;0;gonzaga patriota participa entrevista radio pajeu  0c1nh9qvpq;;;;944905565322571776;https://twitter.com/Nill_Junior/status/944905565322571776
blogviniciuspe;2017-12-24 10:11;0;0;deputado gonzaga patriota reune imprensa tradicional confraternizacao fim  gapatriotareuneimprensatradicionalconfraternizacaofimano 4wu0yfpu;;;;944903308564746240;https://twitter.com/blogviniciuspe/status/944903308564746240
jankomoura;2017-12-24 03:34;1;0;com deputado federal gonzaga patriota durante almoco   hvjkwey8nedp5ppb5dizsm80;;;;944803323500253186;https://twitter.com/jankomoura/status/944803323500253186
waldineypassos;2017-12-23 21:00;0;0;gas agua juntam diz gonzaga patriota sobre aliancas oposicao juntamdizgonzagapatriotasobrealiancasoposicao2018 3i2;;;;944704300114173952;https://twitter.com/waldineypassos/status/944704300114173952
JoseliaMaria_;2017-12-23 17:44;0;0;gonzaga patriota eu acho coisas vao mudar hora entrar paulo camara disser e candidato comecar mudar eu acho propria marilia arraes pode fazer parte governo paulo camara ser candidata governadora 8;;;;944655039968227329;https://twitter.com/JoseliaMaria_/status/944655039968227329
JoseliaMaria_;2017-12-23 17:38;0;0;em confraternizacao deputado gonzaga patriota diz marilia armando podem andar paulo  confraternizacaodeputadofederalgonzagapatriota;;;;944653468026982401;https://twitter.com/JoseliaMaria_/status/944653468026982401
roberto40224824;2017-12-23 11:10;0;0;gonzaga patriota discute sobre perspectiva camara debate blog roberto goncalves ;;;;944555845077127168;https://twitter.com/roberto40224824/status/944555845077127168
roberto40224824;2017-12-23 11:09;0;0;gonzaga patriota discute sobre perspectiva camara debate blog roberto goncalves ;;;;944555590747131904;https://twitter.com/roberto40224824/status/944555590747131904
Nill_Junior;2017-12-22 15:00;0;0;gonzaga patriota prestando contas mandato programa manha total radio pajeu ;;;;944251402305466368;https://twitter.com/Nill_Junior/status/944251402305466368
Nill_Junior;2017-12-22 12:32;0;0;gonzaga patriota diz ser contrario candidatura joaquim barbosa psb  9n1kh;;;;944214149726339075;https://twitter.com/Nill_Junior/status/944214149726339075
Nill_Junior;2017-12-22 08:43;0;0;gonzaga patriota presta contas anuncia emendas sao jose tuparetama  5ac35x1on;;;;944156441522339840;https://twitter.com/Nill_Junior/status/944156441522339840
roberto40224824;2017-12-21 19:27;0;0;gonzaga patriota destina r mil sertania blog roberto goncalves ;;;;943956079993425922;https://twitter.com/roberto40224824/status/943956079993425922
roberto40224824;2017-12-21 19:26;0;0;gonzaga patriota destina r mil sertania blog roberto goncalves ;;;;943955750019153920;https://twitter.com/roberto40224824/status/943955750019153920
midiaemacaotv;2017-12-21 18:16;0;0;o valor e oriundo emenda deputado federal gonzaga patriota destinado manutencao media ;;;;943938210438242305;https://twitter.com/midiaemacaotv/status/943938210438242305
midiaemacaotv;2017-12-21 18:15;0;0;gonzaga patriota destina r mil sertania tadestinar750milsertania ;;;;943938067584442370;https://twitter.com/midiaemacaotv/status/943938067584442370
Nill_Junior;2017-12-21 18:06;0;0;gonzaga patriota destina r mil sertania ;;;;943935642639233024;https://twitter.com/Nill_Junior/status/943935642639233024
Nill_Junior;2017-12-21 08:12;0;0;gonzaga patriota discute perspectivas camara debate  ;;;;943786349177573376;https://twitter.com/Nill_Junior/status/943786349177573376
izaurinobrasil;2017-12-21 04:47;0;0;deputado gonzaga patriota discute sobre perspectiva camara debate  9ckukliqza;;;;943734557261606912;https://twitter.com/izaurinobrasil/status/943734557261606912
Nill_Junior;2017-12-19 17:52;0;0;gonzaga patriota destaca final semana sertao  8dlk2pnmy;;;;943207466128625664;https://twitter.com/Nill_Junior/status/943207466128625664
ParlaTube;2017-12-19 14:43;0;0;dep gonzaga patriota psbpe registra felicitacoes acoes municipios pernambuco ;;;;943159912603045891;https://twitter.com/ParlaTube/status/943159912603045891
ParlaTube;2017-12-19 14:43;0;1;dep gonzaga patriota psbpe registra felicitacoes acoes municipios pernambuco ;;@psbnacamara;;943159889727238144;https://twitter.com/ParlaTube/status/943159889727238144
Francinetto;2017-12-18 14:47;0;0;anos q pai morreu hj deputado gonzaga patriota manda cartao natal enderecado ecaaaaa;;;;942798521471729666;https://twitter.com/Francinetto/status/942798521471729666
blogdidigalvao;2017-12-17 19:11;0;0;artigo o brasil precisa politicas publicas combate drogas gonzaga patriota ;;@Shareaholic;;942502522748534785;https://twitter.com/blogdidigalvao/status/942502522748534785
roberto40224824;2017-12-17 11:59;0;0;gonzaga patriota cumpre agenda sertao pernambucano blog roberto goncalves ;;;;942393785572618240;https://twitter.com/roberto40224824/status/942393785572618240
roberto40224824;2017-12-17 11:57;0;0;gonzaga patriota cumpre agenda sertao pernambucano blog roberto goncalves ;;;;942393398606073856;https://twitter.com/roberto40224824/status/942393398606073856
roberto40224824;2017-12-17 11:56;0;0;gonzaga patriota cumpre agenda sertao pernambucano blog roberto goncalves ;;;;942393187917758469;https://twitter.com/roberto40224824/status/942393187917758469
Nill_Junior;2017-12-17 11:33;0;0;gonzaga patriota cumpriu agenda sertao  ;;;;942387366647554055;https://twitter.com/Nill_Junior/status/942387366647554055
Bymagno_rust1;2017-12-17 09:20;0;0;dep pastor eurico dep gonzaga patriota envolvidos esquema corrupcao junto midas crime heracles ;;;;942353828237672450;https://twitter.com/Bymagno_rust1/status/942353828237672450
waldineypassos;2017-12-16 21:00;0;0;gonzaga patriota e novo cidadao belem sao francisco tanovocidadaobelemsaofrancisco 8ctkcquai;;;;942167627262255104;https://twitter.com/waldineypassos/status/942167627262255104
carlosbritto1;2017-12-16 20:22;0;0;gonzaga patriota tadeu alencar recebem titulos cidadania municipios sertao carlosbrittogonzagapatrio tatadeualencarrecebemtituloscidadaniamunicipiossertao 904bqcz;;;;942158137016160256;https://twitter.com/carlosbritto1/status/942158137016160256
APJuazeiro;2017-12-16 17:24;0;1;gonzaga patriota e novo cidadao belem sao francisco http;;;;942113263478767617;https://twitter.com/APJuazeiro/status/942113263478767617
osecretariopovo;2017-12-16 14:33;0;0;gonzaga patriota e novo cidadao belem sao francisco  tanovocidadaobelemsaofrancisco 0m6fjmhms;;;;942070181236375552;https://twitter.com/osecretariopovo/status/942070181236375552
roberto40224824;2017-12-15 19:55;0;0;camara vereadores belem sao francisco concede titulo cidadao belemita gonzaga patriota blog ;;;;941788881048842240;https://twitter.com/roberto40224824/status/941788881048842240
roberto40224824;2017-12-15 19:55;0;0;camara vereadores belem sao francisco concede titulo cidadao belemita gonzaga patriota blog ;;;;941788779966185472;https://twitter.com/roberto40224824/status/941788779966185472
midiaemacaotv;2017-12-14 15:44;0;0;gonzaga patriota comemora  lugar ranking cnm tacomemora4lugarrankingcnm ;;;;941363192080556032;https://twitter.com/midiaemacaotv/status/941363192080556032
osecretariopovo;2017-12-14 15:17;0;0;gonzaga patriota parlamentares lutam municipios pernambuco  ta4parlamentareslutammunicipiospernambuco 28oc;;;;941356458456899584;https://twitter.com/osecretariopovo/status/941356458456899584
Nill_Junior;2017-12-14 14:22;0;0;gonzaga patriota comemora  lugar ranking cnm  9e9nkw03;;;;941342654348087298;https://twitter.com/Nill_Junior/status/941342654348087298
waldineypassos;2017-12-14 11:00;0;0;deputado gonzaga patriota emite nota pesar morte professora wilza barros gapatriotaemitenotapesarmorteprofessorawilzabarros 0rfon;;;;941291781638979584;https://twitter.com/waldineypassos/status/941291781638979584
carlosbritto1;2017-12-14 08:46;0;0;gonzaga patriota enaltece papel professora maria wilza contribuiu formacao  carlosbrittogonzagapatrio taenaltecepapelprofessoramariawilzacontribuiuformacaovariasgeracoespetrolinenses 7opfpln;;;;941257999191916544;https://twitter.com/carlosbritto1/status/941257999191916544
ParlaTube;2017-12-13 15:19;0;0;dep gonzaga patriota fala sobre vetos faz apelo trabalhadores barragem itaparica ;;;;940994524121362437;https://twitter.com/ParlaTube/status/940994524121362437
ParlaTube;2017-12-13 15:19;0;0;dep gonzaga patriota fala sobre vetos faz apelo trabalhadores barragem itaparica ;;@psbnacamara;;940994509214797824;https://twitter.com/ParlaTube/status/940994509214797824
ParlaTube;2017-12-13 12:49;0;0;dep gonzaga patriota psbpe defende derrubada veto porte arma agentes transito ;;;;940956951147663362;https://twitter.com/ParlaTube/status/940956951147663362
ParlaTube;2017-12-13 12:49;0;0;dep gonzaga patriota psbpe defende derrubada veto porte arma agentes transito ;;@psbnacamara;;940956923368796160;https://twitter.com/ParlaTube/status/940956923368796160
osecretariopovo;2017-12-13 11:27;0;1;amupe gonzaga patriota estar primeiros ranking parlamentares atuantes  patriotaestarprimeirosrankingparlamentaresatuantes;;;;940936307131461632;https://twitter.com/osecretariopovo/status/940936307131461632
midiaemacaotv;2017-12-13 09:48;0;0;quem carece reforma hoje e casa povo brasileiro afirmou deputado gonzaga patriota ;;;;940911282445840384;https://twitter.com/midiaemacaotv/status/940911282445840384
blogdidigalvao;2017-12-13 03:59;0;0;ranking amupe gonzaga patriota e quatro deputados federais atuaram favor municipios ;;@Shareaholic;;940823543381745664;https://twitter.com/blogdidigalvao/status/940823543381745664
ParlaTube;2017-12-12 20:10;0;0;dep gonzaga patriota psbpe apoia projeto sobre agentes comunitarios saude ;;@psbnacamara;;940705529571233792;https://twitter.com/ParlaTube/status/940705529571233792
SandraMirandaTO;2017-12-12 18:54;0;0;mauro carlesse considera absurdo atitude bancada senado os senadores comportando comportou maioria deputados federais chegaram inclusive apoiar projeto deputado gonzaga patriota defende transposicao;;;;940686385559883781;https://twitter.com/SandraMirandaTO/status/940686385559883781
GonzagaGoodNews;2017-12-12 18:30;1;9;news of alumni johnson bademosi 08 is special teams player and db the he was recently featured in an article in which he talked about his football journey including his years at gonzaga click to read more ilpk1149891fromid253789 ;;@Patriots @ESPN;#HailGonzaga #AMDG;940680251939741697;https://twitter.com/GonzagaGoodNews/status/940680251939741697
ParlaTube;2017-12-12 14:52;0;0;dep gonzaga patriota psb fala sobre geracao emprego pe faz apelo derrubada veto ;;;;940625466804883456;https://twitter.com/ParlaTube/status/940625466804883456
ParlaTube;2017-12-12 14:52;0;0;dep gonzaga patriota psb fala sobre geracao emprego pe faz apelo derrubada veto ;;@psbnacamara;;940625452154138625;https://twitter.com/ParlaTube/status/940625452154138625
ParlaTube;2017-12-12 14:47;0;0;dep gonzaga patriota fala sobre reforma previdencia opoe medidas governo ;;;;940624241883582464;https://twitter.com/ParlaTube/status/940624241883582464
PajeuAM;2017-12-12 08:42;0;0;tem algo errado avaliacao deputado gonzaga patriota erradoavaliacaodeputadogonzagapatriota 86cn5sfms;;;;940532282665897984;https://twitter.com/PajeuAM/status/940532282665897984
carlosbritto1;2017-12-11 13:32;0;0;artigo leitor deputado gonzaga patriota destaca importancia agua vida carlosbrittoartigoleit ordeputadogonzagapatriotadestacaimportanciaaguavida 1mkt7o;;;;940242918908092418;https://twitter.com/carlosbritto1/status/940242918908092418
osecretariopovo;2017-12-11 12:38;0;0;a importancia agua vida gonzaga patriota  aguavidagonzagapatriota 6;;;;940229361927680000;https://twitter.com/osecretariopovo/status/940229361927680000
Nill_Junior;2017-12-11 12:10;0;0;artigo a importancia agua vida gonzaga patriota  4h6u7mvgak;;;;940222180075409409;https://twitter.com/Nill_Junior/status/940222180075409409
GU_Boards;2017-12-10 15:38;0;0;huskies pre game press nice finds ceo found this snippet interesting compared to the ne patriots eh quote i always thought of gonzaga like the new england patriots theyre always finding some type of way to win games wright said growing http;;;;939912110049345537;https://twitter.com/GU_Boards/status/939912110049345537
percyallen;2017-12-09 21:04;1;12;s hameir wright on no gonzaga ive always thought of gonzaga like the new england patriots theyre always finding some type of way to win games seattletimessportsuwhusk ybasketballuwsdavidcrispandhameirwrightonbigwinagainstkansasandfacinggonzaga 5hefkbqwb;;@UW_MBB;;939631808412508160;https://twitter.com/percyallen/status/939631808412508160
Partidos_ebooks;2017-12-08 14:42;0;0;gonzaga patriota pe vota impeachment dilma rousseff;;;;939173226445529088;https://twitter.com/Partidos_ebooks/status/939173226445529088
blogdoroberiosa;2017-12-08 08:52;0;0;em serra talhada gonzaga patriota muda discurso esquece votou contra povo  ;;;;939085181536829440;https://twitter.com/blogdoroberiosa/status/939085181536829440
PoliticaReal_;2017-12-07 18:14;0;0;gonzaga patriota volta defender interligacao rios tocantins sao francisco o tocantins beneficiado disse senado real576072gonzagapatriotavoltadefenderinterligacaoriostocantinssaofranciscotocantinstambemserabeneficiadodissesenadowimhbcbiesetwitter ;;;#;938864195000586243;https://twitter.com/PoliticaReal_/status/938864195000586243
ParlaTube;2017-12-07 15:21;0;0;dep gonzaga patriota defende derrubada veto porte armas agentes transito ;;;;938820705906511873;https://twitter.com/ParlaTube/status/938820705906511873
psbnacamara;2017-12-06 16:33;1;0;  deputado gonzaga patriota psbpe quer possibilitar execucao obras licitacao publica  via 8nt;;@psbnacamara;#INFRAESTRUTURA #Ex;938476481654722560;https://twitter.com/psbnacamara/status/938476481654722560
osecretariopovo;2017-12-06 10:57;0;0;gonzaga patriota apresenta plc possibilita exercito brasileiro executar obras engenharia licitacao  taapresentaplcpossibilitaexercitobrasileiroexecutarobrasengenharialicitacaopublica;;;;938391830466564097;https://twitter.com/osecretariopovo/status/938391830466564097
izaurinobrasil;2017-12-06 10:29;0;0;gonzaga patriota quer exercito executando obras engenharia reduzir esquema   0w33d2v;;;;938384821558104064;https://twitter.com/izaurinobrasil/status/938384821558104064
Nill_Junior;2017-12-06 08:34;0;0;gonzaga patriota quer exercito executando obras engenharia reduzir esquema   ;;;;938355995713077248;https://twitter.com/Nill_Junior/status/938355995713077248
ParlaTube;2017-12-05 18:17;0;0;dep gonzaga patriota psbpe fala sobre acoes municipios pernambuco ;;;;938140393673289728;https://twitter.com/ParlaTube/status/938140393673289728
roberto40224824;2017-12-01 20:31;0;0;em araripina gonzaga patriota enfatiza acoes governo paulo camara araripe ouca discurso blog roberto ;;;;936724545318240257;https://twitter.com/roberto40224824/status/936724545318240257
roberto40224824;2017-12-01 20:31;0;0;em araripina gonzaga patriota enfatiza acoes governo paulo camara araripe ouca discurso blog roberto ;;;;936724441404280832;https://twitter.com/roberto40224824/status/936724441404280832
blogviniciuspe;2017-11-30 07:01;0;0;gonzaga patriota participa campanha dias ativismo pelo fim violencia contra   taparticipacampanha16diasativismofimviolenciacontramulher 9g6hq;;;;936158201820729344;https://twitter.com/blogviniciuspe/status/936158201820729344
Marcelodno;2017-11-29 19:37;0;0;deputado vicentinho diz gonzaga patriota transposicao pode comprometer rio tocantins ;;;;935986159515242497;https://twitter.com/Marcelodno/status/935986159515242497
conexaoto;2017-11-29 18:28;0;0;deputado vicentinho diz gonzaga patriota transposicao pode comprometer rio tocantins ;;;;935968738612047872;https://twitter.com/conexaoto/status/935968738612047872
roberto40224824;2017-11-29 16:20;0;0;gonzaga patriota participa campanha dias ativismo pelo fim violencia contra mulher blog roberto ;;;;935936467972513792;https://twitter.com/roberto40224824/status/935936467972513792
ParlaTube;2017-11-29 15:21;0;0;dep gonzaga patriota psb faz registros agradecimentos defende votacao pec ;;;;935921728362090496;https://twitter.com/ParlaTube/status/935921728362090496
ParlaTube;2017-11-29 14:17;0;0;homenagem dia internacional naoviolencia contra mulher dep gonzaga patriota psbpe ;;;;935905487371030529;https://twitter.com/ParlaTube/status/935905487371030529
roberto40224824;2017-11-29 09:56;0;0;cpp entrega documento reivindicando empenho gonzaga patriota todos pe blog roberto goncalves ;;;;935839775038242816;https://twitter.com/roberto40224824/status/935839775038242816
Hanks18;2017-11-29 02:16;0;0;good day ladies hope this finds you all well asked tom brady  gonzaga basketball coach mark few to be in contact w appreciate if you will also that way its not my word alone;;@TheHannahFerg @rihanna @TiffanyATrump @MileyCyrus @Harry_Styles @ZacEfron @Patriots @RyanSeacrest;;935724130510495744;https://twitter.com/Hanks18/status/935724130510495744
ParlaTube;2017-11-28 19:24;0;0;dep gonzaga patriota psbpe destaca projeto sobre colaboracao exercito obras ;;;;935620345259753472;https://twitter.com/ParlaTube/status/935620345259753472
ParlaTube;2017-11-28 16:09;0;0;dep gonzaga patriota psb faz registros fala sobre assalto agencia caixa sertania pe ;;;;935571391197466636;https://twitter.com/ParlaTube/status/935571391197466636
blogdoroberiosa;2017-11-26 20:13;0;0;o deputado federal gonzaga patriota psb entregou dois tratores nessa sextafeira dia lado prefeito ;;;;934908034454904833;https://twitter.com/blogdoroberiosa/status/934908034454904833
blogdoroberiosa;2017-11-26 20:13;0;0;buscando fortalecer projeto reeleicao gonzaga patriota entrega dois tratores   17f2fgfyt;;;;934907975218683906;https://twitter.com/blogdoroberiosa/status/934907975218683906
Allonesportsbet;2017-11-26 17:56;0;0;early games nfl patriots over patriots titans titans panthers panthers nhl predators 110 rangers under 2 grand salami under 2 cbb gonzaga;;;;934873399268057088;https://twitter.com/Allonesportsbet/status/934873399268057088
blogviniciuspe;2017-11-26 15:07;0;0;em afraniope prefeito rafael peron deputado gonzaga patriota entregam dois tratores  prefeitorafaelperondeputadogonzagapatriotaentregamdoistratorespneusinteriormunicipio 98;;;;934830889783250944;https://twitter.com/blogviniciuspe/status/934830889783250944
roberto40224824;2017-11-26 12:05;0;0;afranio ao lado gonzaga patriota prefeito rafael cavalcanti entrega tratores duas comunidades blog ;;;;934785081977262080;https://twitter.com/roberto40224824/status/934785081977262080
roberto40224824;2017-11-26 12:04;0;0;afranio ao lado gonzaga patriota prefeito rafael cavalcanti entrega tratores duas comunidades blog ;;;;934784916675493888;https://twitter.com/roberto40224824/status/934784916675493888
carlosbritto1;2017-11-26 09:10;0;0;ao lado deputado gonzaga patriota psb prefeito afranio pe sertao sao francisco rafael ;;;;934741196223770624;https://twitter.com/carlosbritto1/status/934741196223770624
carlosbritto1;2017-11-26 09:10;0;0;afranio ao lado gonzaga patriota prefeito rafael cavalcanti entrega tratores duas carlosbrittoafraniolad gonzagapatriotaprefeitorafaelcavalcantientregatratoresduascomunidades 6nvwuqtpky;;;;934741151483129856;https://twitter.com/carlosbritto1/status/934741151483129856
blogdoroberiosa;2017-11-25 10:25;0;0;o deputado federal gonzaga patriota psb participando audiencia publica distrito jutai ;;;;934397738200035328;https://twitter.com/blogdoroberiosa/status/934397738200035328
