username;date;retweets;favorites;text;geo;mentions;hashtags;id;permalink
eduardonino;2018-06-11 10:22;0;0;retweeted eduardo deputados psbpe votaram favor golpe danilo cabral fernando coelho filho gonzaga patriota joao fernando coutinho marinaldo rosendo tadeu alencar;;@eduardonino @VAuiar;;1006164742430449664;https://twitter.com/eduardonino/status/1006164742430449664
eduardonino;2018-06-10 22:27;2;2;retweeted eduardo deputados psbpe votaram favor golpe danilo cabral fernando coelho filho gonzaga patriota joao fernando coutinho marinaldo rosendo tadeu alencar;;@eduardonino;;1005984805434155013;https://twitter.com/eduardonino/status/1005984805434155013
eduardonino;2018-06-10 21:46;5;6;deputados psbpe votaram favor golpe danilo cabral fernando coelho filho gonzaga patriota joao fernando coutinho marinaldo rosendo tadeu alencar;;;;1005974426075189250;https://twitter.com/eduardonino/status/1005974426075189250
eduardonino;2018-06-10 21:45;3;3;deputados psbpe votaram favor golpe danilo cabral fernando coelho filho gonzaga patriota joao fernando coutinho marinaldo rosendo tadeu alencar;;;;1005974256776171520;https://twitter.com/eduardonino/status/1005974256776171520
eduardonino;2018-06-10 21:44;1;0;deputados psbpe votaram favor golpe danilo cabral fernando coelho filho gonzaga patriota joao fernando coutinho marinaldo rosendo tadeu alencar;;;;1005974085732626433;https://twitter.com/eduardonino/status/1005974085732626433
Nill_Junior;2018-06-09 16:59;0;0;gonzaga patriota entrega tratores salgueiro  80xfc;;;;1005539903520804864;https://twitter.com/Nill_Junior/status/1005539903520804864
blogdidigalvao;2018-06-09 11:55;0;0;gonzaga patriota entrega dois tratores agricolas comunidades rurais salgueiro taentregadoistratoresagricolascomunidadesruraissalgueiro via;;@blogdidigalvao;;1005463293069352961;https://twitter.com/blogdidigalvao/status/1005463293069352961
paidegabriel;2018-06-06 10:34;0;0;prezado senador colega tocante plantao policial instituido mp primeiras emendas surgiram camara dentre dep gonzaga patriota seria interessante plantao durasse tempo necessario governo federal repor efetivo ;;@JoseMedeirosMT;;1004355802122121216;https://twitter.com/paidegabriel/status/1004355802122121216
ParlaTube;2018-06-05 14:49;0;1;dep gonzaga patriota psbpe registra nota pesar falecimento juarezinho ;;;;1004057715637997568;https://twitter.com/ParlaTube/status/1004057715637997568
ParlaTube;2018-06-05 14:49;0;1;dep gonzaga patriota psbpe registra nota pesar falecimento juarezinho ;;@psbnacamara;;1004057691172397056;https://twitter.com/ParlaTube/status/1004057691172397056
roberto40224824;2018-06-04 19:44;0;0;gonzaga patriota leva investimentos tabira blog roberto goncalves talevainvestimentostabira;;;;1003769460153610240;https://twitter.com/roberto40224824/status/1003769460153610240
roberto40224824;2018-06-04 19:43;0;0;gonzaga patriota leva investimentos tabira blog roberto goncalves talevainvestimentostabira;;;;1003769198948933633;https://twitter.com/roberto40224824/status/1003769198948933633
BLOGDOMAGNO;2018-06-04 17:50;0;1;deputado destina emendas municipio tabira o deputado federal gonzaga patriota psbpe ontem tabira visitando obras modernizacao garantindo emendas municipio  confira integra aqui d190790 ;;;;1003740811429842945;https://twitter.com/BLOGDOMAGNO/status/1003740811429842945
carlosbritto1;2018-06-04 12:01;0;0;nem tudo reluziu ouro deputado federal gonzaga patriota psb neste final semana andancas sertao pernambucano mesmo tendo apoio confirmado carlosbrittogonzagapatrio taganhaaliadosladopodeperderoutro;;;;1003652966815956992;https://twitter.com/carlosbritto1/status/1003652966815956992
carlosbritto1;2018-06-04 12:01;0;0;gonzaga patriota ganha aliados lado pode perder outro carlosbrittogonzagapatrio taganhaaliadosladopodeperderoutro 5b07cosykx;;;;1003652920548585473;https://twitter.com/carlosbritto1/status/1003652920548585473
PajeuAM;2018-06-04 08:06;0;0;prefeito afogados exvice tabira constam lista apoiadores gonzaga patriota afogadosexvicetabirajanaoconstamlistaapoiadoresgonzagapatriota;;;;1003593759035133954;https://twitter.com/PajeuAM/status/1003593759035133954
Nill_Junior;2018-06-04 07:49;0;0;prefeito afogados exvice tabira constam lista apoiadores gonzaga patriota  0fywa6f;;;;1003589615922634753;https://twitter.com/Nill_Junior/status/1003589615922634753
blogviniciuspe;2018-06-03 19:32;0;0;gonzaga patriota recebe apoio prefeitos erefeitos vereadores liderancas politicas  tarecebeapoioprefeitoserefeitosvereadoresliderancaspoliticas 1l;;;;1003404163231944705;https://twitter.com/blogviniciuspe/status/1003404163231944705
Nill_Junior;2018-06-03 18:55;0;0;gonzaga patriota leva investimentos tabira  8id2cs9f1l;;;;1003394746709049345;https://twitter.com/Nill_Junior/status/1003394746709049345
carlosbritto1;2018-06-02 16:36;0;0;em busca mandato camara federal deputado gonzaga patriota psb recebeu adesao diversas liderancas politicas sertao pajeu o apoio consolidado nesta sextafeira carlosbrittogonzagapatrio taconsolidanovosaliadossertao;;;;1002997280176312324;https://twitter.com/carlosbritto1/status/1002997280176312324
carlosbritto1;2018-06-02 16:35;0;0;gonzaga patriota consolida novos aliados sertao carlosbrittogonzagapatrio taconsolidanovosaliadossertao ;;;;1002997234626125824;https://twitter.com/carlosbritto1/status/1002997234626125824
InlandNWSports;2018-06-02 15:29;0;0;gonzaga prep took the win in game one of this double header against the pullman patriots with final score of 7 tune in shortly the second game on am kclx and listentothegame listentothegame;;;;1002980548174741504;https://twitter.com/InlandNWSports/status/1002980548174741504
roberto40224824;2018-06-02 13:54;0;0;gonzaga patriota recebe apoio prefeitos erefeitos vereadores liderancas politicas blog roberto goncalves tarecebeapoioprefeitoserefeitosvereadoresliderancaspoliticas;;;;1002956704563302401;https://twitter.com/roberto40224824/status/1002956704563302401
InlandNWSports;2018-06-02 13:18;0;0;the pullman patriots are going headtohead with gonzaga prep today in american legion baseball tune in the first game of this double header on am kclx and listentothegame listentothegame;;;;1002947577245908992;https://twitter.com/InlandNWSports/status/1002947577245908992
osecretariopovo;2018-06-02 11:36;0;0;gonzaga patriota recebe apoio prefeitos erefeitos vereadores liderancas politicas  tarecebeapoioprefeitoserefeitosvereadoresliderancaspoliticas 9olkdlqt;;;;1002921782351974400;https://twitter.com/osecretariopovo/status/1002921782351974400
roberto40224824;2018-05-30 11:23;0;0;gonzaga patriota sobre greve caminhoneiros desde chamava atencao congresso governo blog roberto goncalves tasobregrevecaminhoneirosdesde2000chamavaatencaocongressogoverno;;;;1001831579126259713;https://twitter.com/roberto40224824/status/1001831579126259713
carlosbritto1;2018-05-30 08:40;0;0;engajado anos camara deputados prol luta transportadores cargas gonzaga patriota psbpe disse ontem 29 durante carlosbrittogonzagapatrio tasobregrevecaminhoneirosdesde2000chamavaatencaocongressogoverno;;;;1001790470308102146;https://twitter.com/carlosbritto1/status/1001790470308102146
carlosbritto1;2018-05-30 08:40;0;0;gonzaga patriota sobre greve caminhoneiros desde chamava atencao congresso governo carlosbrittogonzagapatrio tasobregrevecaminhoneirosdesde2000chamavaatencaocongressogoverno 6u8;;;;1001790438678949888;https://twitter.com/carlosbritto1/status/1001790438678949888
ParlaTube;2018-05-29 19:19;0;0;dep gonzaga patriota psbpe protesta contra importacao coco apoia sindcoco ;;;;1001588893727289345;https://twitter.com/ParlaTube/status/1001588893727289345
ParlaTube;2018-05-29 19:19;0;1;dep gonzaga patriota psbpe protesta contra importacao coco apoia sindcoco ;;@psbnacamara;;1001588870272700416;https://twitter.com/ParlaTube/status/1001588870272700416
csiqueirapsb;2018-05-29 11:10;0;8;recebi nesta manha aqui sede partido brasilia deputado federal pe gonzaga patriota 1m4wcqim8;;;;1001465796017704960;https://twitter.com/csiqueirapsb/status/1001465796017704960
ParlaTube;2018-05-28 18:56;0;1;dep gonzaga patriota psb defende proposta instituir nova constituicao federal ;;@psbnacamara;;1001220785644728325;https://twitter.com/ParlaTube/status/1001220785644728325
Paivasil;2018-05-28 12:36;0;0;gonzaga patriota psb joao f coutinho psb marivaldo roendo psb tadeu alencar psb andre paula psd betinho gomes psdb daniel coelho psdb ricardo teobaldo podemos fonte congresso em foco;;;;1001125002593357829;https://twitter.com/Paivasil/status/1001125002593357829
nibiru201545;2018-05-27 18:21;0;0;morais go nao hissa abrahao am nao leonidas cristino ce nao pompeo mattos rs nao subtenente gonzaga mg nao vicente arruda ce nao total pdt patriota erivelton santana ba sim walney rocha rj nao total pen phs carlos andrade rr sim diego garcia pr sim dr;;;;1000849385809481729;https://twitter.com/nibiru201545/status/1000849385809481729
nibiru201545;2018-05-27 18:20;0;0;sachetti mt sim tila lira pi sim bebeto ba sim creuza pereira pe sim danilo cabral pe nao danilo forte ce sim fabio garcia mt sim flavinho sp sim gonzaga patriota pe sim heitor schuch rs nao heraclito fortes pi sim hugo leal rj sim ildon marques ma sim janete capiberibe;;;;1000849316079132672;https://twitter.com/nibiru201545/status/1000849316079132672
nibiru201545;2018-05-27 18:20;0;0;sim dagoberto ms nao felix mendonca junior ba nao flavia morais go nao hissa abrahao am nao leonidas cristino ce nao pompeo mattos rs nao subtenente gonzaga mg nao vicente arruda ce nao total pdt patriota erivelton santana ba sim walney rocha rj nao total pen;;;;1000849218507026433;https://twitter.com/nibiru201545/status/1000849218507026433
nibiru201545;2018-05-27 18:20;0;0;albuquerque al sim total prp psb adilton sachetti mt sim tila lira pi sim bebeto ba sim creuza pereira pe sim danilo cabral pe nao danilo forte ce sim fabio garcia mt sim flavinho sp sim gonzaga patriota pe sim heitor schuch rs nao heraclito fortes pi sim hugo leal;;;;1000849150970421251;https://twitter.com/nibiru201545/status/1000849150970421251
roberto40224824;2018-05-25 08:45;0;0;gonzaga patriota reforca alerta sobre necessidade investimentos transporte carga pais blog roberto goncalves tareforcaalertasobrenecessidadeinvestimentostransportecargapais;;;;999979699588730880;https://twitter.com/roberto40224824/status/999979699588730880
ParlaTube;2018-05-24 16:02;0;1;gonzaga patriota fala sobre sertania emancipacao municipios greve caminhoneiros ;;@psbnacamara;;999727411079065601;https://twitter.com/ParlaTube/status/999727411079065601
ygorcac;2018-05-24 14:45;2;5;segundo deputado gonzaga patriota  psb pe abriu cabeca caminhoneiros dizendo frase pararem brasil  cara sensacional pioneiro nunca ouvi frase;;;;999707994005925888;https://twitter.com/ygorcac/status/999707994005925888
Nill_Junior;2018-05-24 07:53;0;0;gonzaga patriota reforca alerta sobre necessidade investimentos transporte carga pais  3eqk5okt15;;;;999604369216671744;https://twitter.com/Nill_Junior/status/999604369216671744
DiogoMoraesPSB;2018-05-23 20:47;0;0;na tarde hoje companhia prefeito ngelo ferreira deputado federal gonzaga patriota visitamos diversas obras sede sertania pavimentacao rua edson leite alto ceu creche facebookdiogomoraespsb posts1271053159691852 ;;;;999436800270749697;https://twitter.com/DiogoMoraesPSB/status/999436800270749697
APJuazeiro;2018-05-23 16:43;0;0;gonzaga patriota discutira projeto interligacao rio tocantins sao francisco audiencia publica sertania ;;;;999375211618361346;https://twitter.com/APJuazeiro/status/999375211618361346
lucianobatera13;2018-05-23 09:17;0;0;gonzaga patriota apresenta na cmara de sertnia projeto de ligao dos rios tocantins e so francisco patriotaapresentacamarahtml ;;;;999263053257506816;https://twitter.com/lucianobatera13/status/999263053257506816
ParlaTube;2018-05-22 14:53;0;0;dep gonzaga patriota psbpe fala sobre greve caminhoneiros apoia reivindicacoes ;;;;998985327686705152;https://twitter.com/ParlaTube/status/998985327686705152
ParlaTube;2018-05-22 14:53;0;1;dep gonzaga patriota psbpe fala sobre greve caminhoneiros apoia reivindicacoes ;;@psbnacamara;;998985309768552449;https://twitter.com/ParlaTube/status/998985309768552449
Nill_Junior;2018-05-22 14:01;0;0;gonzaga patriota debate interligacao tocantins sao francisco sertania  53nv3u;;;;998972057177161733;https://twitter.com/Nill_Junior/status/998972057177161733
Nill_Junior;2018-05-21 12:07;0;0;gonzaga patriota intensa agenda pernambuco  08vmxa;;;;998581135675412480;https://twitter.com/Nill_Junior/status/998581135675412480
osecretariopovo;2018-05-20 14:37;0;0;gonzaga patriota cumpre intensa agenda sertao pernambucano leva recursos arcoverde  tacumpreintensaagendasertaopernambucanolevarecursosarcoverde2 ;;;;998256438576377856;https://twitter.com/osecretariopovo/status/998256438576377856
carlosbritto1;2018-05-19 19:28;0;0;em busca nono mandato camara deputados gonzaga patriota psb intensificou agenda dia ontem 18 interior pernambuco o parlamentar carlosbrittoladoirm alvinhogonzagaintensificaagendainteriorpernambuco;;;;997967300186787841;https://twitter.com/carlosbritto1/status/997967300186787841
osecretariopovo;2018-05-19 13:38;0;0;gonzaga patriota cumpre intensa agenda sertao pernambucano leva recursos arcoverde  tacumpreintensaagendasertaopernambucanolevarecursosarcoverde 0ygsovb;;;;997879094334377986;https://twitter.com/osecretariopovo/status/997879094334377986
roberto40224824;2018-05-19 11:49;0;0;gonzaga patriota cumpre intensa agenda sertao pernambucano leva recursos arcoverde blog roberto goncalves tacumpreintensaagendasertaopernambucanolevarecursosarcoverde;;;;997851867181969408;https://twitter.com/roberto40224824/status/997851867181969408
Nill_Junior;2018-05-18 18:01;0;0;gonzaga patriota participa inauguracao teleferico bonito  ;;;;997582909644124160;https://twitter.com/Nill_Junior/status/997582909644124160
carlosbritto1;2018-05-18 11:02;0;0;acompanhe talk show deputado federal gonzaga patriota carlosbrittoacompanheta lkshowdeputadofederalgonzagapatriota carlosbrittoacompanheta lkshowdeputadofederalgonzagapatriota;;;;997477537935757312;https://twitter.com/carlosbritto1/status/997477537935757312
carlosbritto1;2018-05-18 11:02;0;0;acompanhe talk show deputado federal gonzaga patriota carlosbrittoacompanheta lkshowdeputadofederalgonzagapatriota 6;;;;997477478569521152;https://twitter.com/carlosbritto1/status/997477478569521152
carlosbritto1;2018-05-18 11:00;0;0;entrevista gravada deputado federal gonzaga patriota psb vamos acompanhar quais planos deste deputado busca decimo mandato eleicoes deste ano acompanhe facebookblogdocarlosbr ittovideos1996442890407333;;;;997476967963348992;https://twitter.com/carlosbritto1/status/997476967963348992
roberto40224824;2018-05-17 19:18;0;0;gonzaga patriota cobra abastecimento custodia ei leste transposicao blog roberto goncalves tacobraabastecimentocustodiaeilestetransposicao;;;;997239948230217728;https://twitter.com/roberto40224824/status/997239948230217728
carlosbritto1;2018-05-17 17:34;0;0;o convidado talk show blog desta sextafeira 17 deputado federal gonzaga patriota psb natural sertania pe sertao moto gonzaga falara sobre carlosbrittogonzagapatrio taseraentrevistadotalkshowblogdestasextafeira;;;;997213791413833728;https://twitter.com/carlosbritto1/status/997213791413833728
carlosbritto1;2018-05-17 17:34;0;0;gonzaga patriota entrevistado talk show blog desta sextafeira carlosbrittogonzagapatrio taseraentrevistadotalkshowblogdestasextafeira 1kpn2neq;;;;997213704042229761;https://twitter.com/carlosbritto1/status/997213704042229761
Nill_Junior;2018-05-17 07:47;0;0;gonzaga patriota quer custodia atendida canal leste transposicao  ;;;;997066167872311297;https://twitter.com/Nill_Junior/status/997066167872311297
ParlaTube;2018-05-16 16:58;0;0;gonzaga patriota fala sobre transporte alternativo projeto emancipacao municipios ;;;;996842347727151104;https://twitter.com/ParlaTube/status/996842347727151104
ParlaTube;2018-05-16 16:58;0;1;gonzaga patriota fala sobre transporte alternativo projeto emancipacao municipios ;;@psbnacamara;;996842278529523712;https://twitter.com/ParlaTube/status/996842278529523712
LibertyBB18;2018-05-16 16:10;4;5;liberty travels to gonzaga prep spokane the wa state a quarterfinals to take on the selah vikings saturday am winner plays again at pm go patriots 1ej6ky1;;;;996830365774823424;https://twitter.com/LibertyBB18/status/996830365774823424
ParlaTube;2018-05-15 19:26;0;0;dep gonzaga patriota psbpe destaca apreciacao projeto sobre emancipacoes municipios ;;;;996517112100327425;https://twitter.com/ParlaTube/status/996517112100327425
ParlaTube;2018-05-15 19:26;0;1;dep gonzaga patriota psbpe destaca apreciacao projeto sobre emancipacoes municipios ;;@psbnacamara;;996517101606264833;https://twitter.com/ParlaTube/status/996517101606264833
ParlaTube;2018-05-15 19:05;0;0;dep gonzaga patriota requer votacao projeto sobre emancipacao municipios ;;;;996511965815230464;https://twitter.com/ParlaTube/status/996511965815230464
ParlaTube;2018-05-15 19:05;0;1;dep gonzaga patriota requer votacao projeto sobre emancipacao municipios ;;@psbnacamara;;996511954842914817;https://twitter.com/ParlaTube/status/996511954842914817
Javiermolinab;2018-05-15 11:07;13;2;manuel gonzaga dirigente pueblos montubios nuevo usuario avion presidencial en que le aporta al pais mal uso de bienes pblicos favor atender ;;@FiscaliaEcuador;;996391660111192065;https://twitter.com/Javiermolinab/status/996391660111192065
colunaesplanada;2018-05-14 14:35;1;0;entra sai indagado sobre saida eresidente stf joaquim barbosa disputa presidencial deputado gonzaga patriota psbpe ironiza ele entrou;;;;996081637581606914;https://twitter.com/colunaesplanada/status/996081637581606914
LibertyBB18;2018-05-13 05:57;1;1;location set liberty plays selah sat may am at gonzaga prep spokane go patriots 7jsok;;;;995588748581584897;https://twitter.com/LibertyBB18/status/995588748581584897
Nill_Junior;2018-05-12 17:01;0;0;joao campos gonzaga patriota aglailson victor cumprem agenda pajeu  3koyzp9wj;;;;995393653244878848;https://twitter.com/Nill_Junior/status/995393653244878848
roberto40224824;2018-05-11 19:27;0;0;gonzaga patriota lamenta falecimento pedro freire blog roberto goncalves talamentafalecimentopedrofreire;;;;995067884912152576;https://twitter.com/roberto40224824/status/995067884912152576
waldineypassos;2018-05-11 10:00;0;0;gonzaga patriota lucas ramos lamentam morte erefeito terra nova sepultamento acontece hoje 11 talucasramoslamentammorteerefeitoterranova 567drhdq;;;;994925186972516353;https://twitter.com/waldineypassos/status/994925186972516353
blogdidigalvao;2018-05-10 23:36;0;0;gonzaga patriota lamenta falecimento pedro freire talamentafalecimentopedrofreire;;;;994768239308795904;https://twitter.com/blogdidigalvao/status/994768239308795904
ParlaTube;2018-05-10 14:57;0;0;dep gonzaga patriota psbpe fala sobre seguranca publica pe cobra codevasf ;;;;994637482997272579;https://twitter.com/ParlaTube/status/994637482997272579
ParlaTube;2018-05-10 14:57;0;1;dep gonzaga patriota psbpe fala sobre seguranca publica pe cobra codevasf ;;@psbnacamara;;994637463846113281;https://twitter.com/ParlaTube/status/994637463846113281
Nill_Junior;2018-05-10 07:54;0;0;gonzaga patriota participa  edicao seminario brasileiro transporte rodoviario cargas  94n;;;;994531156497436672;https://twitter.com/Nill_Junior/status/994531156497436672
roberto40224824;2018-05-09 22:53;0;0;gonzaga patriota incentiva seminario setor transportes blog roberto goncalves taincentivaseminariosetortransportes;;;;994394909800062976;https://twitter.com/roberto40224824/status/994394909800062976
ParlaTube;2018-05-09 14:43;0;0;dep gonzaga patriota psb fala sobre agricultura familiar apoia transportadores carga ;;;;994271598231384065;https://twitter.com/ParlaTube/status/994271598231384065
ParlaTube;2018-05-09 14:43;0;1;dep gonzaga patriota psb fala sobre agricultura familiar apoia transportadores carga ;;@psbnacamara;;994271577498947585;https://twitter.com/ParlaTube/status/994271577498947585
PoliticaReal_;2018-05-09 13:04;0;0;deputado gonzaga patriota xxviii seminario brasileiro transportes cargas http;;@YouTube;;994246780958199810;https://twitter.com/PoliticaReal_/status/994246780958199810
Nill_Junior;2018-05-09 07:42;0;0;gonzaga patriota incentiva seminario setor transportes  6;;;;994165785181540352;https://twitter.com/Nill_Junior/status/994165785181540352
ParlaTube;2018-05-08 16:24;0;0;dep gonzaga patriota psbpe registra protesto defesa produtores pontal sul ;;;;993934594096484352;https://twitter.com/ParlaTube/status/993934594096484352
ParlaTube;2018-05-08 16:24;0;1;dep gonzaga patriota psbpe registra protesto defesa produtores pontal sul ;;@psbnacamara;;993934563146715138;https://twitter.com/ParlaTube/status/993934563146715138
roberto40224824;2018-05-05 18:59;0;0;gonzaga patriota diz ter medo chapao morte crava povo pernambucano quer aposentadoria blog roberto goncalves tadiznaotermedochapaomortecravapovopernambucanonaoqueraposentadoria;;;;992886454710874112;https://twitter.com/roberto40224824/status/992886454710874112
carlosbritto1;2018-05-05 12:00;0;0;caminhando forte tentar nono mandato camara federal deputado federal gonzaga patriota psb conta imensas carlosbrittogonzagapatrio tadiznaotermedochapaomortecravapovopernambucanonaoqueraposentadoria;;;;992781075364700160;https://twitter.com/carlosbritto1/status/992781075364700160
carlosbritto1;2018-05-05 12:00;0;0;gonzaga patriota diz ter medo chapao morte crava povo pernambucano quer aposentadoria carlosbrittogonzagapatrio tadiznaotermedochapaomortecravapovopernambucanonaoqueraposentadoria 5k6ckv;;;;992781043030790144;https://twitter.com/carlosbritto1/status/992781043030790144
mikedietsche;2018-05-05 10:13;0;1;update i warn gonzaga to f off now lets drink patriots;;;;992754204119838721;https://twitter.com/mikedietsche/status/992754204119838721
Boomer_Patriot;2018-05-04 20:53;0;0;gonzaga university formally warns students about appropriating cinco mayo niversityformallywarnsstudentsaboutappropriatingcincomayowuzyimgt78twitter ;;;#;992552905927548928;https://twitter.com/Boomer_Patriot/status/992552905927548928
Boomer_Patriot;2018-05-04 20:52;0;0;gonzaga university formally warns students about appropriating cinco mayo niversityformallywarnsstudentsaboutappropriatingcincomayowuzysz32m4twitter ;;;#;992552637261340672;https://twitter.com/Boomer_Patriot/status/992552637261340672
ParlaTube;2018-05-02 14:53;0;0;dep gonzaga patriota destaca ampliacao malha aerea pe congresso nacional cartorios ;;@janete_nacamara;;991737560023162880;https://twitter.com/ParlaTube/status/991737560023162880
ParlaTube;2018-05-02 14:53;0;0;dep gonzaga patriota destaca ampliacao malha aerea pe congresso nacional cartorios ;;;;991737480700399617;https://twitter.com/ParlaTube/status/991737480700399617
ParlaTube;2018-05-02 14:53;0;1;dep gonzaga patriota destaca ampliacao malha aerea pe congresso nacional cartorios ;;@psbnacamara;;991737467542831106;https://twitter.com/ParlaTube/status/991737467542831106
JJ_Gonzaga;2018-04-30 17:46;0;1; ainda intitula patriota pqp;;;;991056334765350912;https://twitter.com/JJ_Gonzaga/status/991056334765350912
roberto40224824;2018-04-27 11:35;0;0;gonzaga patriota participa congresso nacional cartorios blog roberto goncalves taparticipacongressonacionalcartorios;;;;989875726508855296;https://twitter.com/roberto40224824/status/989875726508855296
osecretariopovo;2018-04-27 09:56;0;0;gonzaga patriota participa congresso nacional cartorios  taparticipacongressonacionalcartorios 3amklatd4;;;;989850684622327814;https://twitter.com/osecretariopovo/status/989850684622327814
Nill_Junior;2018-04-27 09:07;0;0;gonzaga patriota participa congresso nacional cartorios  2c9ahkz3ih;;;;989838429872586753;https://twitter.com/Nill_Junior/status/989838429872586753
gonzaga_rendon;2018-04-26 15:05;0;0;el patriota piensa el sospechoso es ivan cepeda;;;;989566230901264389;https://twitter.com/gonzaga_rendon/status/989566230901264389
psbnacamara;2018-04-25 20:17;0;1;  em discurso deputado gonzaga patriota psbpe homenageia brasilia  via 7prcs7izl;;@psbnacamara;#PLEN;989282377196277760;https://twitter.com/psbnacamara/status/989282377196277760
Nill_Junior;2018-04-25 14:37;0;0;gonzaga patriota debate fundo constitucional investimentos nordeste  5lfs3y6vgu;;;;989196816808857600;https://twitter.com/Nill_Junior/status/989196816808857600
ParlaTube;2018-04-25 13:53;0;0;dep gonzaga patriota psb parabeniza vereadores destaca importancia marcha vereadores ;;;;989185639051616257;https://twitter.com/ParlaTube/status/989185639051616257
ParlaTube;2018-04-25 13:53;0;1;dep gonzaga patriota psb parabeniza vereadores destaca importancia marcha vereadores ;;@psbnacamara;;989185626904973312;https://twitter.com/ParlaTube/status/989185626904973312
ParlaTube;2018-04-25 12:11;0;1;homenagem postuma eeputado luis eduardo magalhaes dep gonzaga patriota psbpe ;;@psbnacamara;;989159941012324352;https://twitter.com/ParlaTube/status/989159941012324352
ParlaTube;2018-04-24 15:02;1;1;dep gonzaga patriota pe registra falecimento faz homenagem brasilia ;;@psbnacamara;;988840496683536384;https://twitter.com/ParlaTube/status/988840496683536384
PetronioSanto;2018-04-21 13:11;0;0;nao esqueca dizer fora gonzaga patriota;;;;987725513618808832;https://twitter.com/PetronioSanto/status/987725513618808832
EdmarLyra;2018-04-20 23:49;0;0;antonio souza recebe apoio gonzaga patriota senado edmarlyraantoniosouza recebeapoiogonzagapatriotasenado ;;;;987523696637173760;https://twitter.com/EdmarLyra/status/987523696637173760
blogviniciuspe;2018-04-20 21:01;0;0;gonzaga patriota participa evento transportadores autonomos cargas regiao nordeste  taparticipaeventotransportadoresautonomoscargasregiaonordeste 66en0xkr;;;;987481295600136192;https://twitter.com/blogviniciuspe/status/987481295600136192
