username;date;retweets;favorites;text;geo;mentions;hashtags;id;permalink
pat_nevesbr;2017-11-16 21:12;0;1;"Pastor , tá na Bíblia: o amor ao dinheiro (do povo pior ainda) é a raiz de todos os males.";;;;"931298988506038272";https://twitter.com/pat_nevesbr/status/931298988506038272
Vasti01804100;2017-11-16 14:38;0;1;"Meu corpo! Minhas regras!";;;;"931199743509884929";https://twitter.com/Vasti01804100/status/931199743509884929
Omar_r47m4ch1n3;2017-11-16 13:21;2;2;"Bora! #ForaTemer @marcossoaresdep @antoniojacome @diegogarciapr @erosbiondini @evandrogussi @GilbertoPSC20 @jtadeumudalen @DepJefferson @passarinho5555 @LeonardoQuintao @PastorEurico @DF_PauloFreire @Alan_Rick @GivaldoCarimbao @maurolp4 @flavinhocn @depjoaocampos @DepSostenes pic.twitter.com/Bk27mm7Wco";;@marcossoaresdep @antoniojacome @diegogarciapr @erosbiondini @evandrogussi @GilbertoPSC20 @jtadeumudalen @DepJefferson @passarinho5555 @LeonardoQuintao @PastorEurico @DF_PauloFreire @Alan_Rick @GivaldoCarimbao @maurolp4 @flavinhocn @depjoaocampos @DepSostenes;#ForaTemer;"931180514051891200";https://twitter.com/Omar_r47m4ch1n3/status/931180514051891200
dddoesitSOLO;2017-11-15 21:29;0;2;"TINHA QUE TER UM FILHO DA PUTA CHAMADO " PASTOR EURICO "";;;;"930940845028765696";https://twitter.com/dddoesitSOLO/status/930940845028765696
efeo;2017-11-15 18:13;0;1;"Se conseguíssemos arrancar a CEAP eles teriam que usar o salário coisas pessoais, assim como os mortais fazem com muito esforço.";;;;"930891508785532928";https://twitter.com/efeo/status/930891508785532928
Paula_nonato24;2017-11-15 17:20;0;0;"Pastorzinho tá começando a ficar unipresente";;;;"930878270358413312";https://twitter.com/Paula_nonato24/status/930878270358413312
roberthaad;2017-11-15 14:57;0;1;"Muita competência pra gastar e nenhuma pra representar o povo!";;;;"930842308131598336";https://twitter.com/roberthaad/status/930842308131598336
AdalbertoApLima;2017-11-15 14:56;0;0;"O lugar que ele gastou R$14,00 não possui CNPJ, será que existe mesmo esse lugar.";;;;"930841892887121920";https://twitter.com/AdalbertoApLima/status/930841892887121920
cheff_dallagnol;2017-11-15 09:37;0;0;"Super deputado .... Estamos de olho....";;;;"930761582212247553";https://twitter.com/cheff_dallagnol/status/930761582212247553
FPaulistano;2017-11-15 07:45;0;8;"É tanto tempo gastando dinheiro que deve faltar tempo para trabalhar.";;;;"930733380928458752";https://twitter.com/FPaulistano/status/930733380928458752
NetSidnei;2017-11-15 07:24;0;0;"Comentei sobre o recibo específico que estava no link, que realmente não te nada de mais. Ao invés de você gastar seu tempo criticando os outros no Twitter, vai fazer alguma coisa de útil por esse país.";;;;"930728263441420288";https://twitter.com/NetSidnei/status/930728263441420288
NetSidnei;2017-11-15 07:11;0;0;"Está falando comigo?";;;;"930724819691298817";https://twitter.com/NetSidnei/status/930724819691298817
glayberthon;2017-11-15 05:23;0;2;"Caralho pastor , de novo? Pqp vamo ver isso aí né???";;;;"930697795018940417";https://twitter.com/glayberthon/status/930697795018940417
efeo;2017-11-15 04:45;1;1;"00:36 Comeu em uma pizzaria em Recife. 04:43 Pegou um voo de Recife pra Brasília. 09:28 Comeu um Misto Quente em Brasília. 14:18 Almoçou 12:47 e 15:40 Alguém lá em Recife colocou GNV em nome dele, e às 09:35 foi Gasolina 23:52 R$ 100 de combustível em Brasília.";;;;"930688086371168257";https://twitter.com/efeo/status/930688086371168257
efeo;2017-11-15 04:43;0;1;"Os gastos não são suspeitos, são caros "apenas" e infelizmente a CEAP permite que o parlamentar coma até morrer mesmo que a porção da morte custe o olho da cara. Tem é que acabar na raiz, cortando a CEAP.";;;;"930687688864337922";https://twitter.com/efeo/status/930687688864337922
efeo;2017-11-15 04:39;0;0;"O que está teoricamente errado no que aconteceu neste dia foi alguém ter colocado GNV e Gasolina em veículos lá em Recife com ele estando em Brasília, mesmo que o valor seja baixo. As refeições estão coerentes em relação aos lugares.";;;;"930686682302738433";https://twitter.com/efeo/status/930686682302738433
efeo;2017-11-15 04:37;0;0;"00:36 Comeu em uma pizzaria em Recife. 04:43 Pegou um voo de Recife pra Brasília. 09:28 Comeu um Misto Quente em Brasília. 14:18 Almoçou 12:47 e 15:40 Alguém lá em Recife colocou GNV em nome dele, e às 09:35 foi Gasolina 23:52 R$ 100 de combustível em Brasília.";;;;"930686212486156288";https://twitter.com/efeo/status/930686212486156288
efeo;2017-11-15 04:22;1;10;"00:36 Comeu em uma pizzaria em Recife. 04:43 Pegou um voo de Recife pra Brasília. 09:28 Comeu um Misto Quente em Brasília. 14:18 Almoçou 12:47 e 15:40 Alguém lá em Recife colocou GNV em nome dele, e às 09:35 foi Gasolina 23:52 R$ 100 de combustível em Brasília.";;;;"930682513500065793";https://twitter.com/efeo/status/930682513500065793
RosieDaSerenata;2017-11-15 04:00;14;40;"Gasto suspeito de Dep. @pastoreurico (PE). Você pode me ajudar a verificar? https:// jarbas.serenatadeamor.org/#/documentId/5 612046 … #SerenataDeAmor na @CamaraDeputados";;@pastoreurico @CamaraDeputados;# #SerenataDeAmor;"930676912749465600";https://twitter.com/RosieDaSerenata/status/930676912749465600
LeandroPianaro;2017-11-15 01:18;1;1;"Bom saber que não é só o dePUTAdo aí que viaja na velocidade da luz.... Ou será que é só preguiça de pensar mesmo?";;;;"930636039877734400";https://twitter.com/LeandroPianaro/status/930636039877734400
justiceiro100;2017-11-14 22:52;0;0;"Até quando essa FARRA desses MALANDROS VAI DURAR??? Ganhando mais de 30 mil reais por mês e torrando meu DINHEIRO DE IMPOSTOS com comida... FORA VAGABUNDOS PILANTRAS!!!!!!";;;;"930599432088932352";https://twitter.com/justiceiro100/status/930599432088932352
ulissesdebrito;2017-11-14 22:46;0;0;"Qual a explicação? Será que está na Bíblia tbm ??";;;;"930597740702322688";https://twitter.com/ulissesdebrito/status/930597740702322688
SilvaRand;2017-11-14 22:37;1;1;"Que porra é essa deputado? Vai pro inferno desse jeito @PastorEurico";;@PastorEurico;;"930595641172119552";https://twitter.com/SilvaRand/status/930595641172119552
Uuuuuuujhhhh;2017-11-14 22:28;0;1;"Pra mim todo gasto com alimentação eh um escárnio";;;;"930593254038437888";https://twitter.com/Uuuuuuujhhhh/status/930593254038437888
theus_ramos1;2017-11-14 22:10;2;5;"Temos aqui um Deputado Onipresente.";;;;"930588743572041730";https://twitter.com/theus_ramos1/status/930588743572041730
potchaco;2017-11-14 22:09;0;2;"Este gasto não é abusivo. Nesta refeição ele gastou R$14,00 em um misto e um café expresso com leite. Porém existem gastos suspeitos do deputado no mesmo mês como nestes casos: https:// jarbas.serenatadeamor.org/#/year/2015/ap plicantId/2264/documentId/5617120 … https:// jarbas.serenatadeamor.org/#/year/2015/ap plicantId/2264/documentId/5604584 … https:// jarbas.serenatadeamor.org/#/year/2015/ap plicantId/2264/documentId/5604582 … https:// jarbas.serenatadeamor.org/#/year/2015/ap plicantId/2264/documentId/5599178 …";;;# # # #;"930588487232950272";https://twitter.com/potchaco/status/930588487232950272
morgadovi75;2017-11-14 22:07;1;7;"Deputado the Flash... em vários lugares no mesmo dia !!! Aguardamos sua explicação! Obrigada. De nada!";;;;"930587926597074944";https://twitter.com/morgadovi75/status/930587926597074944
Sandro_arvox;2017-11-14 22:06;0;0;"Retweeted Rosie ( @RosieDaSerenata ): Gasto suspeito de Dep. @pastoreurico (PE). Você pode me ajudar a verificar?... http:// fb.me/4tpCAPDda";;@RosieDaSerenata @pastoreurico;;"930587837963100160";https://twitter.com/Sandro_arvox/status/930587837963100160
NetSidnei;2017-11-14 22:05;0;1;"Sem problemas, dentro dos padrões normais.";;;;"930587413579169792";https://twitter.com/NetSidnei/status/930587413579169792
RosieDaSerenata;2017-11-14 22:01;16;44;"Gasto suspeito de Dep. @pastoreurico (PE). Você pode me ajudar a verificar? https:// jarbas.serenatadeamor.org/#/documentId/5 612149 … #SerenataDeAmor na @CamaraDeputados";;@pastoreurico @CamaraDeputados;# #SerenataDeAmor;"930586484595453953";https://twitter.com/RosieDaSerenata/status/930586484595453953
derotikas;2017-11-13 14:59;0;1;"ahazzou Pena que até agora nenhum respondeu né Mas na hora de pedir voto pra ter salário bom com comissão (pra não dizermos propERROR msm) aparece candidato até do buero ....";;;;"930117952652894209";https://twitter.com/derotikas/status/930117952652894209
kennymauro;2017-11-13 13:20;0;0;"https://www. cartacapital.com.br/politica/comis sao-aprova-projeto-que-restringe-aborto-ate-em-caso-de-estupro … " Pastor Eurico (PHS-PE) - Sim". Claro que foi com ideais religiosos e não baseado em crenças individuais. Mesmo q a mulher tenha risco de vida ela n pode abortar. Baseado em religião.";;;;"930092918223892480";https://twitter.com/kennymauro/status/930092918223892480
unicorn28Larry;2017-11-12 16:40;0;0;"@depjorgetadeu @DF_PauloFreire @DepJefferson @flavinhocn @gilbertonjr @evandrogussi @diegogarciapr @antoniojacome @LeonardoQuintao @passarinho5555 @depmarcossoares @PastorEurico @GivaldoCarimbao https:// twitter.com/vecle/status/9 28575793080528896 …";;@depjorgetadeu @DF_PauloFreire @DepJefferson @flavinhocn @gilbertonjr @evandrogussi @diegogarciapr @antoniojacome @LeonardoQuintao @passarinho5555 @depmarcossoares @PastorEurico @GivaldoCarimbao;;"929780885787901952";https://twitter.com/unicorn28Larry/status/929780885787901952
unicorn28Larry;2017-11-12 16:39;0;0;"@depjorgetadeu @DF_PauloFreire @DepJefferson @flavinhocn @gilbertonjr @evandrogussi @diegogarciapr @antoniojacome @LeonardoQuintao @passarinho5555 @depmarcossoares @PastorEurico @GivaldoCarimbao https:// twitter.com/mnandaaria/sta tus/928444070690684928 …";;@depjorgetadeu @DF_PauloFreire @DepJefferson @flavinhocn @gilbertonjr @evandrogussi @diegogarciapr @antoniojacome @LeonardoQuintao @passarinho5555 @depmarcossoares @PastorEurico @GivaldoCarimbao;;"929780737687027713";https://twitter.com/unicorn28Larry/status/929780737687027713
unicorn28Larry;2017-11-12 16:39;1;0;"@depjorgetadeu @DF_PauloFreire @DepJefferson @flavinhocn @gilbertonjr @evandrogussi @diegogarciapr @antoniojacome @LeonardoQuintao @passarinho5555 @depmarcossoares @PastorEurico @GivaldoCarimbao https:// twitter.com/derotikas/stat us/928383797682458626 …";;@depjorgetadeu @DF_PauloFreire @DepJefferson @flavinhocn @gilbertonjr @evandrogussi @diegogarciapr @antoniojacome @LeonardoQuintao @passarinho5555 @depmarcossoares @PastorEurico @GivaldoCarimbao;;"929780660822315009";https://twitter.com/unicorn28Larry/status/929780660822315009
brauliobw;2017-11-12 02:54;0;0;"Correção: Pastor Eurico é do PHS-PE. #vergonha #naoapec181 @erikakokay foi a única que representou as mulheres e o direito à dignidade.";;@erikakokay;#vergonha #naoapec181;"929573158553780230";https://twitter.com/brauliobw/status/929573158553780230
brauliobw;2017-11-12 02:52;0;0;"Parabéns @erikakokay , dentre todos foi a única que votou pela vida e pelo respeito às mulheres. Pastor Eurico envergonhou PE. #naoapec181 pic.twitter.com/GIMm9TMbu1";;@erikakokay;#naoapec181;"929572588367511557";https://twitter.com/brauliobw/status/929572588367511557
ricardobaade;2017-11-11 14:50;0;0;"Levou a Família pra comer tb, deputado? Nem no Fogo de chão aqui em SP vc gasta esse valor.";;;;"929390826509225985";https://twitter.com/ricardobaade/status/929390826509225985
vinisimoes;2017-11-11 08:44;0;0;"Brandindo uma réplica de um feto de 12 semanas, o deputado Pastor Eurico (PHS-PE) discursava contra o aborto: "On... https:// getpocket.com/@8cQp4TRjA499b dbs91g4f90gb5d5A98f2cFS24d21fH332Zd6c5b9fd0yfYSk283/share/2837658 …";;@8cQp4TRjA499b;;"929298791731204096";https://twitter.com/vinisimoes/status/929298791731204096
marcknho;2017-11-10 23:22;0;0;"@blogdojefferson @jairbolsonaro @alefrotabrasil @BolsonaroSP @JoseMedeirosMT @alex_borges @roxmo @marcofeliciano @PauloMartins10 @FernandoHoliday @JanainaDoBrasil @Francischini_ @ronaldocaiado @alberto_fraga @PastorEurico @lincoln_portela @flavinhocn @rogeriosmarinho Absurdo https:// twitter.com/ElbaLapaz/stat us/929108461861900292 …";;@blogdojefferson @jairbolsonaro @alefrotabrasil @BolsonaroSP @JoseMedeirosMT @alex_borges @roxmo @marcofeliciano @PauloMartins10 @FernandoHoliday @JanainaDoBrasil @Francischini_ @ronaldocaiado @alberto_fraga @PastorEurico @lincoln_portela @flavinhocn @rogeriosmarinho;;"929157471649894401";https://twitter.com/marcknho/status/929157471649894401
sintraveic;2017-11-10 22:39;0;1;"Dep federal Pastor Eurico , combate o cartel do transportes de veículos em Pernambuco!!!! pic.twitter.com/hE0S8k4BKE";;;;"929146441280389121";https://twitter.com/sintraveic/status/929146441280389121
ArexiaOliveira;2017-11-10 15:11;0;0;"Deputados que se denominam Pastor Eurico e Flavinho não deveriam ter essa credibilidade toda";;;;"929033716609044480";https://twitter.com/ArexiaOliveira/status/929033716609044480
marcknho;2017-11-10 14:08;0;1;"Onde esta a dignidade dos políticos, vão fazer o povo pagar quem roubou a nação? @jairbolsonaro @marcofeliciano @Francischini_ @alberto_fraga @PastorEurico @DepSostenes @flavinhocn @MarcosRogerio @jcaleluia https:// twitter.com/Gisaieira/stat us/929016474869682177 …";;@jairbolsonaro @marcofeliciano @Francischini_ @alberto_fraga @PastorEurico @DepSostenes @flavinhocn @MarcosRogerio @jcaleluia;;"929018050392875008";https://twitter.com/marcknho/status/929018050392875008
ifgerson;2017-11-10 08:04;0;1;"Antônio Jácome Diego Garcia Eros Biondini Evandro Gussi Flavinho Gilberto Nascimento Jefferson Campos João Campos Joaquim Passarinho Jorge Tadeu Mudalen Leonardo Quintão Marcos Soares Pastor Eurico Paulo Freire Alan Rick Givllado Carimbão Mauro Pereira Sóstenes Cavalcante";;;;"928926230577139712";https://twitter.com/ifgerson/status/928926230577139712
ColaresMaira;2017-11-10 04:19;1;1;"Pastor Eurico , um dos 18 deputados que aprovaram a criminalização do aborto em casos de estupro, recebeu doações de empresa envolvida em esquema de lavagem de dinheiro http:// veja.abril.com.br/brasil/empresa s-alvos-da-operacao-turbulencia-fizeram-doacao-a-ex-ministro-do-desenvolvimento/#…";;;#;"928869591576694784";https://twitter.com/ColaresMaira/status/928869591576694784
PereiraSdc;2017-11-10 01:46;1;0;"Ó os 18: @PastorEurico @DF_PauloFreire @Alan_Rick @GivaldoCarimbao @flavinhocn tem mais... http://www. viomundo.com.br/denuncias/mulh eres-vao-as-ruas-contra-pec-que-obriga-vitima-de-estupro-a-ter-o-filho.html … via @viomundo";;@PastorEurico @DF_PauloFreire @Alan_Rick @GivaldoCarimbao @flavinhocn @viomundo;;"928831079393452032";https://twitter.com/PereiraSdc/status/928831079393452032
GengibreKi;2017-11-10 01:21;5;4;"O deputado Pernambucano que votou a favor da PEC 181, que é uma violação dos direitos das mulheres. Pastor Eurico (PHS-PE) Homens não tem q decidir por nós e não tem q legislar por nós.";;;;"928824849199398912";https://twitter.com/GengibreKi/status/928824849199398912
soulokinao;2017-11-09 23:04;0;0;"" pastor eurico " https:// twitter.com/BeatrizCianci1 /status/928614047955775488 …";;;;"928790510050992129";https://twitter.com/soulokinao/status/928790510050992129
uizlei;2017-11-09 22:29;1;5;"edit: o Pastor Eurico (PHS - PE) é negro";;;;"928781506692173824";https://twitter.com/uizlei/status/928781506692173824
uizlei;2017-11-09 21:35;0;0;"Na verdade, o Pastor Eurico é do PHS/PE";;;;"928768061116690432";https://twitter.com/uizlei/status/928768061116690432
DIGOLEIx;2017-11-09 18:40;2;0;"PASTOR EURICO isso só pode ser uma piada https:// twitter.com/BeatrizCianci1 /status/928614047955775488 …";;;;"928723959184609280";https://twitter.com/DIGOLEIx/status/928723959184609280
breno_leonardo;2017-11-09 16:46;0;0;"Parasitas!!!";;;;"928695289850073093";https://twitter.com/breno_leonardo/status/928695289850073093
danielamaiab;2017-11-09 16:34;1;8;"Pastor Eurico (PHS-PE) discursava contra o aborto: "Onde está o amor pelas mulheres? Onde está o amor pelas crianças?" e completou: "Isso não tem a ver com religião, é uma posição! Nós somos contra esse assassinato em massa de inocentes." Já disse o quanto odeio pastores?";;;;"928692175566761985";https://twitter.com/danielamaiab/status/928692175566761985
ladiesbitch3s;2017-11-09 16:24;0;2;"PASTOR Eurico (novidade né)";;;;"928689726479065088";https://twitter.com/ladiesbitch3s/status/928689726479065088
betinaraquell;2017-11-09 16:13;0;0;"Aqui os nomes! Se der um zoom da pra ler " PASTOR EURICO ". Eu sinceramente acho/acredito/espero que não vai passar no plenário, oremos pic.twitter.com/2bpce2apsW";;;;"928687014018461696";https://twitter.com/betinaraquell/status/928687014018461696
GuidoSanick;2017-11-09 16:10;0;0;"Pastor Eurico está relacionado erroneamente à Rondônia, já avisei em outro post do site!! Segundo pesquisa feita há pouco, seria do PHS de PE";;;;"928686171215093769";https://twitter.com/GuidoSanick/status/928686171215093769
GuidoSanick;2017-11-09 16:07;0;0;"Pastor Eurico não representa Rondônia";;;;"928685397235982336";https://twitter.com/GuidoSanick/status/928685397235982336
friedxnoodles;2017-11-09 15:10;0;0;"pastor eurico seguinte vc eh um merda";;;;"928671210673790977";https://twitter.com/friedxnoodles/status/928671210673790977
adoreluvsparty;2017-11-09 15:05;0;2;"pastor eurico ...........a velho https:// twitter.com/amandamvale/st atus/928417453067198465 …";;;;"928669980681531392";https://twitter.com/adoreluvsparty/status/928669980681531392
thaysethaysfer;2017-11-09 13:35;2;0;"Sóstenes Cavalcante (DEM-RJ) - Sim Jorge Tadeu Mudalen (DEM-SP) - Sim Marcos Soares (DEM-RJ) - Sim Pastor Eurico (PHS-PE) - Sim Antônio Jácome (PODE-RN) - Sim João Campos (PRB-GO) - Sim Paulo Freire (PR-SP) - Sim Jefferson Campos (PSD-SP) - Sim Joaquim Passarinho (PSD-PA) - Sim";;;;"928647158726823936";https://twitter.com/thaysethaysfer/status/928647158726823936
vinm_;2017-11-09 13:07;0;1;"Pastor Eurico (PHS-PE): o debate "não é religioso" e que "o Brasil não defende aborto". logo em seguida: "Defender aborto é uma ação, gostem ou não gostem, satânica, diabólica, destruidora" cala essa sua boca cara. só fica quieto";;;;"928640217648648195";https://twitter.com/vinm_/status/928640217648648195
MYFLOWXR;2017-11-09 13:02;0;0;"* pastor * eurico > pastor < " pastor " https:// twitter.com/amandamvale/st atus/928417453067198465 …";;;;"928639002252541952";https://twitter.com/MYFLOWXR/status/928639002252541952
DilMonteiro;2017-11-09 13:01;0;0;"Cadê as justificativas, Deputado? Ou não teria como justificar?";;;;"928638620654858240";https://twitter.com/DilMonteiro/status/928638620654858240
AndressaFVaz;2017-11-09 12:47;0;1;"MANO PASTOR EURICO ANAO PLMDD";;;;"928635153072652288";https://twitter.com/AndressaFVaz/status/928635153072652288
tatafyeah;2017-11-09 12:46;1;2;"Antônio Jácome, Diego Garcia , Eros Biondini, Evandro Gussi, Flavinho, João Campos, Joaquim Passarinho, Jorge Tadeu Mudalen, Leonardo Quintão, Marcos Soares, Pastor Eurico , Paulo Freire, Alan Rick, Givllado Carimbão, Mauro Pereira, Sóstenes Cavalcante FILHOS DA PUTA";;;;"928634958633107457";https://twitter.com/tatafyeah/status/928634958633107457
ParlaTube;2017-11-09 12:18;0;0;"Homenagem às Santas Casas, Hospitais e Entidades Filantrópicas. Dep. Pastor Eurico (PHS-PE) https:// youtu.be/PHTGSquv4Gc";;;;"928627763380146176";https://twitter.com/ParlaTube/status/928627763380146176
ParlaTube;2017-11-09 12:18;0;0;"@PastorEurico Homenagem às Santas Casas, Hospitais e Entidades Filantrópicas. Dep. Pastor Eurico (PHS-PE) https:// youtu.be/PHTGSquv4Gc";;@PastorEurico;;"928627737727766528";https://twitter.com/ParlaTube/status/928627737727766528
helton_masamune;2017-11-09 11:43;0;2;"" Pastor Eurico "... que nojo dessa politica mano que NOJO https:// twitter.com/Mari6033/statu s/928373832708214790 …";;;;"928618962878902273";https://twitter.com/helton_masamune/status/928618962878902273
messiaspe;2017-11-09 11:00;0;1;"Pastor Eurico (PHS-PE) é um crápula da pior espécie. Seus fiéis sendo governados por um lobo devorador da moral dos outros.";;;;"928608276442484736";https://twitter.com/messiaspe/status/928608276442484736
Gabicarvalhols;2017-11-09 10:43;0;0;"COntinuação de quem votou a favor da PEC: Leonardo Quintão (PMDB-MG),Marcos Soares (DEM-RJ), Pastor Eurico (PHS-PE),Paulo Freire (PR-SP),Alan Rick (DEM-AC),Givllado Carimbão (PHS-AL),Mauro Pereira (PMDB-RS),Sóstenes Cavalcante (DEM-RJ) #pec181";;;#pec181;"928604031089561600";https://twitter.com/Gabicarvalhols/status/928604031089561600
AltVenancio;2017-11-09 10:18;0;0;"Pastor Eurico citando a Bíblia no congresso nacional #siconiif";;;#siconiif;"928597721866481665";https://twitter.com/AltVenancio/status/928597721866481665
dxstrange;2017-11-09 07:22;0;0;"Houve a fecundação, é vida. Acabou — avaliou o Pastor Eurico .” ISSO FOI A COISA MAIS RÍDICULA QUE JÁ VI NA MINHA VIDA";;;;"928553314639400960";https://twitter.com/dxstrange/status/928553314639400960
Flamengo_Zicooo;2017-11-08 23:08;0;3;"Goool do Pastor porra,Fica Eurico ,meu cartola agradece";;;;"928428988242038786";https://twitter.com/Flamengo_Zicooo/status/928428988242038786
Sumbullsht;2017-11-08 22:58;0;2;"Pastor Eurico (PHS-PE) Antônio Jácome (PODE-RN) João Campos (PRB-GO) Paulo Freire (PR-SP) Jefferson Campos (PSD-SP) Joaquim Passarinho (PSD-PA) Eros Biondini (PROS-MG) Flavinho (PSB-SP) Evandro Gussi (PV-SP) Diego Garcia (PHS-PR)";;;;"928426425341890560";https://twitter.com/Sumbullsht/status/928426425341890560
eueduardoparada;2017-11-08 22:40;1;2;"PASTOR Eurico ....... P-A-S-T-O-R... pic.twitter.com/mo9Cklvbrb";;;;"928422117200355328";https://twitter.com/eueduardoparada/status/928422117200355328
raqueldamico;2017-11-08 21:07;1;0;""Favorável à medida, o deputado Pastor Eurico (PHS-PE) chegou a dizer que há uma "matança" de fetos, uma "destruição em massa de inocentes", no Brasil" VAI TOMAR NO CU CARALHO";;;;"928398672471224320";https://twitter.com/raqueldamico/status/928398672471224320
astarcheran;2017-11-08 21:06;0;0;"18 votos dos parlamentares chamado “bancada da Bíblia” Pastor Eurico (PHS-PE) discursava contra o aborto: "Isso não tem a ver com religião, é uma posição! Nós somos contra esse assassinato em massa de inocentes."";;;;"928398246027911168";https://twitter.com/astarcheran/status/928398246027911168
IamRodrigo;2017-11-08 21:03;1;1;"Hoje foi votada a PEC 181/2011, que libera homens, através do estupro, a forçarem mulheres a ter seus filhos. Ela segue ao Senado. A culpa é de - Parte 5 Pastor Eurico (PHS-PE) (s/ Twitter, então @phs31nacional ) Paulo Freire (PR-SP) @DF_PauloFreire Alan Rick (DEM-AC) @Alan_Rick";;@phs31nacional @DF_PauloFreire @Alan_Rick;;"928397537500901376";https://twitter.com/IamRodrigo/status/928397537500901376
GugaNoblat;2017-11-08 20:45;11;12;"Parte 2 Sóstenes Cavalcante (DEM-RJ) Jorge Tadeu Mudalen (DEM-SP) Marcos Soares (DEM-RJ) Pastor Eurico (PHS-PE) Antônio Jácome (PODE-RN) João Campos (PRB-GO) - Sim Paulo Freire (PR-SP) - Sim";;;;"928392942095667200";https://twitter.com/GugaNoblat/status/928392942095667200
MiileeSouza;2017-11-08 20:24;3;4;"“Favorável à medida, o deputado Pastor Eurico (PHS-PE) chegou a dizer que há uma "matança" de fetos, uma "destruição em massa de inocentes", no Brasil.” MATANÇA DE FETOS, DESTRUIÇÃO EM MASSA SOCORRROOOOOOOOO!!!!!!!!!! pic.twitter.com/qu2XJVSC0O";;;;"928387765024194561";https://twitter.com/MiileeSouza/status/928387765024194561
xuxuzinhaMar12;2017-11-08 19:41;0;0;"Sóstenes Cavalcante (DEM-RJ) - Sim Jorge Tadeu Mudalen (DEM-SP) - Sim Marcos Soares (DEM-RJ) - Sim Pastor Eurico (PHS-PE) - Sim Antônio Jácome (PODE-RN) - Sim João Campos (PRB-GO) - Sim Paulo Freire (PR-SP) - Sim Jefferson Campos (PSD-SP) - Sim Joaquim Passarinho (PSD-PA) - Sim";;;;"928376976561397763";https://twitter.com/xuxuzinhaMar12/status/928376976561397763
aryanetada;2017-11-08 19:33;1;0;"Érika - Não Gilberto - Sim Leonardo - Sim Givaldo - Sim Mauro - Sim Alan - Sim Sóstenes - Sim Jorge Tadeu - Sim Marcos - Sim Pastor Eurico - Sim Antônio - Sim João - Sim Paulo - Sim Jefferson - Sim Joaquim - Sim Eros - Sim Flavinho - Sim Evandro - Sim Diego - Sim #PEC181";;;#PEC181;"928374918273740801";https://twitter.com/aryanetada/status/928374918273740801
digoislam;2017-11-08 16:30;0;0;"Enquanto o trabalhador tem que contar moedas no fim do mês para ter o que comer, estes deputados gastam 200 reais em bife com dinheiro do contribuinte. Esta mamata tem que acabar";;;;"928328985259503617";https://twitter.com/digoislam/status/928328985259503617
LeiteMrcia;2017-11-08 16:27;0;0;"Pouca vergonha! Ainda querem aprovar reformas arbitrárias em nossas Costa!";;;;"928328175423295493";https://twitter.com/LeiteMrcia/status/928328175423295493
mtam74;2017-11-08 16:19;0;0;"Coitado de nos. Vamos comer terra ate quando? Povo de Deus esse pastor nao tem nada haver com milagre a realidade é que nos estamos sendo devorados";;;;"928326022730256386";https://twitter.com/mtam74/status/928326022730256386
FabioPenedo;2017-11-08 16:02;0;0;"eiiita!!!! que bode caro da gota @pastoreurico !!!!! é isso mesmo?? temos que pagar suas refeições aos sábados??";;@pastoreurico;;"928321914082340864";https://twitter.com/FabioPenedo/status/928321914082340864
Pr_ADILSONBENNY;2017-11-08 15:07;0;0;"@PastorEurico o sr. Não faz nada por Pernambuco? Seu blog é horrível, e ainda anda pagando refeições pros outros...";;@PastorEurico;;"928308072174555136";https://twitter.com/Pr_ADILSONBENNY/status/928308072174555136
Pr_ADILSONBENNY;2017-11-08 15:03;0;0;"Pastor Eurico pagando refeição pra si e pra família com dinheiro publico??? Pra comer é uma onça pra trabalhar é aos empurrões!!! absurdo que essa corja ainda se reeleja!!!";;;;"928307009065242625";https://twitter.com/Pr_ADILSONBENNY/status/928307009065242625
lekobatera;2017-11-08 14:02;0;0;"Que vergonha!!! Estamos de olho ... Ja vou ligar pra minha Vó e familia em pernambuco... É melhor mudarem de deputado...";;;;"928291671321739264";https://twitter.com/lekobatera/status/928291671321739264
