username;date;retweets;favorites;text;geo;mentions;hashtags;id;permalink
prnacamara;2018-06-08 15:34;1;1;"Começa agora a sessão solene em homenagem aos 45 anos da @infraero , o deputado Sebastião Oliveira é um dos autores do requerimento para a realização da solenidade. pic.twitter.com/Oes1wIU2Xv";;@infraero;;"1005156142828457986";https://twitter.com/prnacamara/status/1005156142828457986
BLOGDOMAGNO;2018-06-07 13:27;0;0;"Pernambuco recebe mais de R$ 20 milhões em recursos O presidente estadual do Partido da República, deputado Sebastião Oliveira , assegurou o repasse, por parte do Ministério, de R$ 22,5 milhões extras para Pernambuco. [...] Confira na íntegra aqui: http://www. blogdomagno.com.br/ver_post.php?i d=190884 …";;;;"1004761819641204738";https://twitter.com/BLOGDOMAGNO/status/1004761819641204738
osecretariopovo;2018-06-07 09:40;0;0;"Deputado Sebastião Oliveira anuncia R$ 20 milhões para Pernambuco e avanços no Aeroporto de Serra Talhada http:// osecretariodopovo.com/deputado-sebas tiao-oliveira-anuncia-r-20-milhoes-para-pernambuco-e-avancos-no-aeroporto-de-serra-talhada/ … pic.twitter.com/hd6F8BWRxd";;;;"1004704755451510786";https://twitter.com/osecretariopovo/status/1004704755451510786
MarcoRaposo28;2018-06-06 20:44;1;1;"Deputado Sebastião Oliveira , sempre defendendo os interesses do povo Pernambucano pic.twitter.com/2RpOU6JCe8";;;;"1004509302781079556";https://twitter.com/MarcoRaposo28/status/1004509302781079556
BLOGDOMAGNO;2018-05-11 16:54;0;1;"Aeroporto do Recife continuará ampliando voos Artigo do deputado federal Sebastião Oliveira . [...] Confira na íntegra aqui: http:// blogdomagno.com.br/ver_post.php?i d=189837 …";;;;"995029375434264577";https://twitter.com/BLOGDOMAGNO/status/995029375434264577
celioborges2012;2018-05-05 01:42;0;0;"O Prefeito de São Vicente Ferrer Flávio Regis com sua equipe, recebe a ilustre visita do seu Deputado Federal Sebastião Oliveira do PR ex Secretário Estadual de Transportes no município nesta sexta - feira... https://www. facebook.com/celioborgesbom jardimpe/posts/2198599773499779 …";;;;"992625669426335744";https://twitter.com/celioborges2012/status/992625669426335744
joaopauloe40;2018-04-23 11:33;0;0;"Na última sexta-feira dia (20) vinte, acompanhamos o Deputado Federal Sebastião Oliveira em visita ao Serc, onde fomos recebidos pela colaboradora Maria Das Dores Brito que explanou o trabalho da referida... https://www. facebook.com/joaopaulodelem os40/posts/445620042518762 …";;;;"988425621322784768";https://twitter.com/joaopauloe40/status/988425621322784768
estenioelbainy;2018-03-16 12:43;0;0;"Sebastião Machado Oliveira , mais conhecido como Sibá Machado, deputado (Acre) do partido dos "guerreiros" diria que os atuais acontecimentos é obra da CIA?";;;;"974672616584830976";https://twitter.com/estenioelbainy/status/974672616584830976
osecretariopovo;2018-03-01 14:56;0;0;"Nota do deputado Federal Sebastião Oliveira sobre a morte de Geni Pereira http:// osecretariodopovo.com/nota-do-deputa do-federal-sebastiao-oliveira-sobre-a-morte-de-geni-pereira/ …";;;;"969270044780892162";https://twitter.com/osecretariopovo/status/969270044780892162
blogdoroberiosa;2018-02-10 06:34;0;0;"O prefeito de Serra Talhada, Luciano Duque (PT), voltou a provocar o deputado Sebastião Oliveira (PR), que... https:// fb.me/SxexyqY3";;;;"962243426782728192";https://twitter.com/blogdoroberiosa/status/962243426782728192
blogdoroberiosa;2018-02-01 14:04;0;0;"O deputado licenciado e secretário de transportes, Sebastião Oliveira (PR), realmente passou por uma metamorfose... https:// fb.me/1sxnHdn6m";;;;"959095168476606465";https://twitter.com/blogdoroberiosa/status/959095168476606465
blogdoroberiosa;2018-02-01 12:40;0;0;"O prefeito Luciano Duque (PT) devolveu o recado do deputado Sebastião Oliveira (PR), que ao lançar um bloco... https:// fb.me/7mgpArv2r";;;;"959074055621144576";https://twitter.com/blogdoroberiosa/status/959074055621144576
blogdoroberiosa;2018-01-29 15:22;0;0;"Na primeira semana de janeiro deste ano, o deputado licenciado e secretário de transportes, Sebastião Oliveira ... https:// fb.me/2wwa9yeqw";;;;"958027478295089153";https://twitter.com/blogdoroberiosa/status/958027478295089153
blogdoroberiosa;2018-01-29 14:26;0;1;"Na primeira semana de janeiro deste ano, o deputado licenciado e secretário de transportes, Sebastião Oliveira ... https:// fb.me/2NLyqlT97";;;;"958013467646201857";https://twitter.com/blogdoroberiosa/status/958013467646201857
blogdoroberiosa;2018-01-26 17:57;0;0;"O deputado federal licenciado e secretário de transportes, Sebastião Oliveira (PR), juntamente com o Ministro... https:// fb.me/2w7lb1ZWH";;;;"956979447139307520";https://twitter.com/blogdoroberiosa/status/956979447139307520
blogdoroberiosa;2018-01-24 22:42;0;0;"O secretário de transportes e deputado licenciado, Sebastião Oliveira , se reuniu nesta quarta-feira, dia 24, em... https:// fb.me/19i4ElXvO";;;;"956326485966704640";https://twitter.com/blogdoroberiosa/status/956326485966704640
blogdoroberiosa;2018-01-23 23:16;0;0;"De olho na reeleição, o secretário de transportes e deputado federal licenciado, Sebastião Oliveira (PR) e o... https:// fb.me/NOzHPVt9";;;;"955972472800759808";https://twitter.com/blogdoroberiosa/status/955972472800759808
jcarlosmachado;2018-01-20 20:05;3;2;"Na procissão a São Sebastião , em Poço Verde, que reuniu fiéis e autoridades, como o prefeito, Igor Oliveira , e sua esposa; o deputado André Moura, o senador Amorim; o ex-prefeito e ex-deputado federal Everaldo Oliveira ; Dr Gonzaga, além de vereadores e secretários municipais. pic.twitter.com/MM5JAMT9Pl";;;;"954837412672344064";https://twitter.com/jcarlosmachado/status/954837412672344064
portalflorespe;2018-01-17 16:34;1;0;"Na opinião de Sebastião Oliveira , Augusto César é “um deputado copa do mundo” https:// fb.me/8gh9drXwL";;;;"953697012511334400";https://twitter.com/portalflorespe/status/953697012511334400
blogdoroberiosa;2018-01-13 06:03;0;0;"O Secretário de Transportes e Deputado licenciado, Sebastião Oliveira (PR), apagou do seu histórico político os... https:// fb.me/9jqTEZxPU";;;;"952088710924918784";https://twitter.com/blogdoroberiosa/status/952088710924918784
blogdoroberiosa;2017-12-18 22:09;0;0;"Deputado Júlio Cavalcanti solicita requalificação da PE-270 e ataca Sebastião Oliveira -... https:// fb.me/DO0QGUCm";;;;"942909815432597504";https://twitter.com/blogdoroberiosa/status/942909815432597504
blogdoroberiosa;2017-12-18 22:07;0;0;"Deputado Júlio Cavalcanti solicita requalificação da PE-270 e ataca Sebastião Oliveira na… http:// roberiosa.com.br/na-alepe-deput ado-dispara/ … pic.twitter.com/ztbMevLjtZ";;;;"942909156960423936";https://twitter.com/blogdoroberiosa/status/942909156960423936
mrclmnzs;2017-10-25 21:28;0;0;"muita vergonha de Sebastião Oliveira , deputado federal de Serra Talhada, que só envergonha o Sertão e Pernambuco.";;;;"923330547967053826";https://twitter.com/mrclmnzs/status/923330547967053826
ancoradosertao;2017-10-24 10:12;0;0;"Sebastião Oliveira vai assumir novamente mandato de deputado federal para livrar a… https:// ancoradosertao.com.br/sebastiao-oliv eira-vai-assumir-novamente-mandato-de-deputado-federal-para-livrar-carapuca-de-temer/ … pic.twitter.com/SH6rZqs3Nz";;;;"922797838651846656";https://twitter.com/ancoradosertao/status/922797838651846656